title,author_name,author_url,publication_date,description,category,image_url,url,countries,content_preview,source,lang,content,source_name
Benin vs Rwanda: Gernot Rohr Unveils 25-Player Squad of the Squirrels,,,1728126932,"Ahead of the double-header against the Squirrels of Benin, who will take on the Rwandan national football team during the third and fourth matches of the...",,"data:image/gif;base64,R0lGODlhAQABAIAAAP///////yH5BAEKAAEALAAAAAABAAEAAAICTAEAOw==",https://www.footboom1.com/en/news/football/1894750-benin-vs-rwanda-gernot-rohr-unveils-25-player-squad-of-the-squirrels&ved=2ahUKEwi60vqQxPeIAxU8SDABHTVXCA4QxfQBegQICBAC&usg=AOvVaw3NIPnBKOMf7mePd_q-Up6Y,Benin,,google_news,en,From Google News,FootBoom
"Benin man Ofure Akpolo jailed for $22,297.97 internet fraud",,,1728112532,"Court sentences Ofure Prince Akpolo to three years imprisonment over involvement in $22297.97 internet fraud in Benin, Edo State.",,"data:image/gif;base64,R0lGODlhAQABAIAAAP///////yH5BAEKAAEALAAAAAABAAEAAAICTAEAOw==",https://pmnewsnigeria.com/2024/10/05/benin-man-ofure-akpolo-jailed-for-22297-97-internet-fraud/&ved=2ahUKEwi60vqQxPeIAxU8SDABHTVXCA4QxfQBegQICRAC&usg=AOvVaw3WKrUx28j05ns5zfAy976Q,Benin,,google_news,en,From Google News,PM News Nigeria
"Benin Court Jails Man For $22,297.97 Internet Fraud",,,1728116132,Justice W.I. Aziegbemhin of the Edo State High Court has sentenced Ofure Prince Akpolo to three years in prison for retaining proceeds of crime totalling...,,"data:image/gif;base64,R0lGODlhAQABAIAAAP///////yH5BAEKAAEALAAAAAABAAEAAAICTAEAOw==",https://newtelegraphng.com/benin-court-jails-man-for-22297-97-internet-fraud/&ved=2ahUKEwi60vqQxPeIAxU8SDABHTVXCA4QxfQBegQIARAC&usg=AOvVaw1qqFkwQcc1qfaapdG5Xvgv,Benin,,google_news,en,From Google News,New Telegraph
From Benin to the World: Gbriel’s Gospel Music Ministry,,,1728058532,"Aideyan Gabriel Osuyi, known professionally as Gbriel, is a Nigeria-born and UK-based gospel singer, songwriter, and music director inspiring countless...",,"data:image/gif;base64,R0lGODlhAQABAIAAAP///////yH5BAEKAAEALAAAAAABAAEAAAICTAEAOw==",https://www.thisdaylive.com/index.php/2024/10/04/from-benin-to-the-world-gbriels-gospel-music-ministry/&ved=2ahUKEwi60vqQxPeIAxU8SDABHTVXCA4QxfQBegQIABAC&usg=AOvVaw2I2vQNzuB3GPb9U3TYCa8c,Benin,,google_news,en,From Google News,THISDAYLIVE
Ammunition depot manager course kicks off in Benin,,,1728058532,"Following discussions between Direction of Materiel, two trainings has been identified, such as optronic workshop and ammunition depot manager”.",,"data:image/gif;base64,R0lGODlhAQABAIAAAP///////yH5BAEKAAEALAAAAAABAAEAAAICTAEAOw==",https://www.eeas.europa.eu/eeas/ammunition-depot-manager-course-kicks-benin_en&ved=2ahUKEwi60vqQxPeIAxU8SDABHTVXCA4QxfQBegQIBBAC&usg=AOvVaw3f8TAl4_MwG7j8Yp4CDE4V,Benin,,google_news,en,From Google News,EEAS
Coup d'État déjoué au Bénin: Le parti les démocrates brise le silence,,,1728058532,Le parti Les Démocrates dénonce le flou artistique et la confusion qui entourent le coup d'état déjoué impliquant Olivier Boko et Oswald Homeky au Bénin.,,"data:image/gif;base64,R0lGODlhAQABAIAAAP///////yH5BAEKAAEALAAAAAABAAEAAAICTAEAOw==",https://www.youtube.com/watch%3Fv%3DfdGUBajTjxA&ved=2ahUKEwi60vqQxPeIAxU8SDABHTVXCA4QxfQBegQIBhAC&usg=AOvVaw2JICd7DfzSm23efrC2-u2b,Benin,,google_news,en,From Google News,YouTube
"NPFL 25: Insurance Coach, Monday Odigie Ask For More Support After Shooting Stars Fall in Benin",,,1727972132,"Bendel Insurance Football Club coach Monday Odigie has asked for more support after Bendel Insurance secured 1-0 victory over Shooting Stars on Wednesday,...",,"data:image/gif;base64,R0lGODlhAQABAIAAAP///////yH5BAEKAAEALAAAAAABAAEAAAICTAEAOw==",https://www.sports247.ng/npfl-25-insurance-coach-monday-odigie-ask-for-more-support-after-shooting-stars-fall-in-benin/&ved=2ahUKEwi60vqQxPeIAxU8SDABHTVXCA4QxfQBegQIAhAC&usg=AOvVaw3e9DrcxVq5TMgG5d-vK0uD,Benin,,google_news,en,From Google News,Sports247 Nigeria
Alleged Coup Plot Rocks Benin’s Political Landscape,,,1727972132,Two figures close to Benin's President Patrice Talon have been remanded in custody following accusations of orchestrating a coup attempt.,,"data:image/gif;base64,R0lGODlhAQABAIAAAP///////yH5BAEKAAEALAAAAAABAAEAAAICTAEAOw==",https://medafricatimes.com/36640-alleged-coup-plot-rocks-benins-political-landscape.html&ved=2ahUKEwi60vqQxPeIAxU8SDABHTVXCA4QxfQBegQIAxAC&usg=AOvVaw0XJ_EU_kAyCkaAFlG5908M,Benin,,google_news,en,From Google News,Medafrica Times
"Gov. Obaseki, in new interview, reacts to speculations of rift with Benin royal palace over artefacts (VIDEO)",,,1727972132,"Governor Obaseki, despite the whirlwind of his government responsibilities, recently broke his silence to confront a storm of swirling misconceptions and...",,"data:image/gif;base64,R0lGODlhAQABAIAAAP///////yH5BAEKAAEALAAAAAABAAEAAAICTAEAOw==",https://www.withinnigeria.com/entertainment/2024/10/03/gov-obaseki-in-new-interview-reacts-to-speculations-of-rift-with-benin-royal-palace-over-artefacts-video/&ved=2ahUKEwi60vqQxPeIAxU8SDABHTVXCA4QxfQBegQIBxAC&usg=AOvVaw3MxwQOI0Z0RIZxlceKr7WG,Benin,,google_news,en,From Google News,Within Nigeria
Benin President’s Close Associates Sentenced for Alleged Coup Plot,,,1727972132,"Two associates of Benin's President Patrice Talon have been jailed on suspicions of plotting a coup. The two men – Olivier Boko, a businessman and Talon's...",,"data:image/gif;base64,R0lGODlhAQABAIAAAP///////yH5BAEKAAEALAAAAAABAAEAAAICTAEAOw==",https://iafrica.com/benin-presidents-close-associates-sentenced-for-alleged-coup-plot/&ved=2ahUKEwi60vqQxPeIAxU8SDABHTVXCA4QxfQBegQIBRAC&usg=AOvVaw03f-QX2GvIVsM3fSHN7oUa,Benin,,google_news,en,From Google News,iAfrica
Morocco consolidates its position as the new African reference at the global level,,,1728144574,Morocco's importance in strengthening stability in Africa vis-à-vis the rest of the world has positioned the Alawi country as one of the most visible faces...,,"data:image/gif;base64,R0lGODlhAQABAIAAAP///////yH5BAEKAAEALAAAAAABAAEAAAICTAEAOw==",https://www.atalayar.com/en/articulo/politics/morocco-consolidates-its-position-the-new-african-reference-at-the-global-level/20241005170000205934.html&ved=2ahUKEwiK2LmSxPeIAxV65ckDHZP3L5UQxfQBegQIBhAC&usg=AOvVaw33fxRer1Y0XV9wK-2LfetT,Morocco,,google_news,en,From Google News,Atalayar
Orange Alert: Severe Thunderstorms and Hailstorms Forecasted for Sunday in Morocco,,,1728144634,"The General Directorate of Meteorology (DGM) has issued an orange weather alert, warning of severe thunderstorms, hail, and strong winds expected to hit...",,"data:image/gif;base64,R0lGODlhAQABAIAAAP///////yH5BAEKAAEALAAAAAABAAEAAAICTAEAOw==",https://www.moroccoworldnews.com/2024/10/365592/orange-alert-severe-thunderstorms-and-hailstorms-forecasted-for-sunday-in-morocco&ved=2ahUKEwiK2LmSxPeIAxV65ckDHZP3L5UQxfQBegQICRAC&usg=AOvVaw2fwajqEKLwLAjiYVhmqgyI,Morocco,,google_news,en,From Google News,Morocco World News
Outrage Mounts Over European Court’s Western Sahara Ruling,,,1728141334,"A day after the European Court of Justice (ECJ) issued its final ruling on the agriculture and fisheries agreement with Morocco, Belgium and Hungary joined...",,"data:image/gif;base64,R0lGODlhAQABAIAAAP///////yH5BAEKAAEALAAAAAABAAEAAAICTAEAOw==",https://www.moroccoworldnews.com/2024/10/365591/outrage-mounts-over-european-courts-western-sahara-ruling&ved=2ahUKEwiK2LmSxPeIAxV65ckDHZP3L5UQxfQBegQIABAC&usg=AOvVaw2jtrPYlItB1OUzI_uX48Ks,Morocco,,google_news,en,From Google News,Morocco World News
Hungary Backs Strengthening EU-Morocco Partnership Amid CJEU Ruling,,,1728137734,"Hungary has reaffirmed its commitment to strengthening the European Union's strategic partnership with Morocco, despite a recent ruling from the Court of...",,"data:image/gif;base64,R0lGODlhAQABAIAAAP///////yH5BAEKAAEALAAAAAABAAEAAAICTAEAOw==",https://moroccoworldnews.com/2024/10/365589/hungary-backs-strengthening-eu-morocco-partnership-amid-cjeu-ruling&ved=2ahUKEwiK2LmSxPeIAxV65ckDHZP3L5UQxfQBegQIBxAC&usg=AOvVaw0JUYtn1GZHHxfEYcjjYnkv,Morocco,,google_news,en,From Google News,Morocco World News
Europe Delivers a Harsh Blow to the Friendship Between Sánchez and Morocco,,,1728137734,The ECJ overturned the EU-Morocco trade agreements because they were made without the consent of the people of Western Sahara.,,"data:image/gif;base64,R0lGODlhAQABAIAAAP///////yH5BAEKAAEALAAAAAABAAEAAAICTAEAOw==",https://www.moroccomail.fr/2024/10/05/europe-delivers-a-harsh-blow-to-the-friendship-between-sanchez-and-morocco/&ved=2ahUKEwiK2LmSxPeIAxV65ckDHZP3L5UQxfQBegQIBRAC&usg=AOvVaw0nUsauZDNO4YqQvzsH_z3W,Morocco,,google_news,en,From Google News,Maghreb Online
"Sahara: UN Chief highlights Morocco’s diplomatic achievements, holds Algeria accountable & decries Polisario violations",,,1728134134,The 2024 report submitted lately to the UN Security Council by UN Chief Antonio Guterres highlights the growing international support for Morocco's autonomy...,,"data:image/gif;base64,R0lGODlhAQABAIAAAP///////yH5BAEKAAEALAAAAAABAAEAAAICTAEAOw==",https://northafricapost.com/80801-sahara-un-chief-highlights-moroccos-diplomatic-achievements-holds-algeria-accountable-decries-polisario-violations.html&ved=2ahUKEwiK2LmSxPeIAxV65ckDHZP3L5UQxfQBegQIARAC&usg=AOvVaw1WlY6WtuWZbtDh3IlX5C7f,Morocco,,google_news,en,From Google News,The North Africa Post
Fisheries & Farming Accords: EU voices strong attachment to strategic partnership with Morocco,,,1728134134,"The European Union has expressed strong attachment to the strategic partnership built with Morocco, following the ruling issued Friday by the European Court...",,"data:image/gif;base64,R0lGODlhAQABAIAAAP///////yH5BAEKAAEALAAAAAABAAEAAAICTAEAOw==",https://northafricapost.com/80798-fisheries-farming-accords-eu-voices-strong-attachment-to-strategic-partnership-with-morocco.html&ved=2ahUKEwiK2LmSxPeIAxV65ckDHZP3L5UQxfQBegQICBAC&usg=AOvVaw3dExCeA_ANf3kl384Ge3Fo,Morocco,,google_news,en,From Google News,The North Africa Post
Belgium Reaffirms Support for EU-Morocco Partnership Amid ECJ Ruling,,,1728130534,Belgium has voiced its support for the EU's response to the recent European Court of Justice (ECJ) rulings on trade agreements involving Western Sahara.,,"data:image/gif;base64,R0lGODlhAQABAIAAAP///////yH5BAEKAAEALAAAAAABAAEAAAICTAEAOw==",https://www.moroccoworldnews.com/2024/10/365586/belgium-reaffirms-support-for-eu-morocco-partnership-amid-ecj-ruling&ved=2ahUKEwiK2LmSxPeIAxV65ckDHZP3L5UQxfQBegQIAxAC&usg=AOvVaw1Z8UXpZUJygHc-nxFqyTow,Morocco,,google_news,en,From Google News,Morocco World News
Rally-Raid. Morocco last of the World Championship launched (GALLERY) - Dakar,,,1728130534,"Last test of the 2024 World Championship, authentic technical preview of the 2025 Dakar. KTM returns, Dacia debuts, full Ford lineup.",,"data:image/gif;base64,R0lGODlhAQABAIAAAP///////yH5BAEKAAEALAAAAAABAAEAAAICTAEAOw==",https://www.ruetir.com/2024/10/05/rally-raid-morocco-last-of-the-world-championship-launched-gallery-dakar-ruetir/&ved=2ahUKEwiK2LmSxPeIAxV65ckDHZP3L5UQxfQBegQIBBAC&usg=AOvVaw0aME5iTtJIHb9iJ_DEkOWk,Morocco,,google_news,en,From Google News,Ruetir
"Morocco, Ambassador Balla “Partnership? The ball is in Europe’s court”",,,1728130534,ROME (ITALPRESS) – “The ball is now entirely in the European court. Europe must decide what it wants to do with the partnership with Morocco. We expect.,,"data:image/gif;base64,R0lGODlhAQABAIAAAP///////yH5BAEKAAEALAAAAAABAAEAAAICTAEAOw==",https://www.italpress.com/morocco-ambassador-balla-partnership-the-ball-is-in-europes-court/&ved=2ahUKEwiK2LmSxPeIAxV65ckDHZP3L5UQxfQBegQIAhAC&usg=AOvVaw1iP8h9EdML30pFWZQ3rGWP,Morocco,,google_news,en,From Google News,Italpress
