title,author_name,author_url,publication_date,description,category,image_url,url,countries,content_preview,source,lang,content,source_name
Mali : l’absence prolongée de Choguel Maïga suscite des interrogations au sommet de l’État,Kevin Aka,https://beninwebtv.com/author/kevin/,2 octobre 2024,"L'inquiétude monte au sein du gouvernement malien face aux désaccords et à l'absence prolongée du Premier ministre Choguel Kokalla Maïga, en poste depuis la...",Politique,https://i0.wp.com/beninwebtv.com/wp-content/uploads/2022/11/316686222_6139520669400707_7980771922106447195_n-1.jpg?resize=696%2C464&ssl=1,https://beninwebtv.com/mali-labsence-prolongee-de-choguel-maiga-suscite-des-interrogations-au-sommet-de-letat/,Mali,,beninwebtv,fr,,
Mali : Washington renforce son soutien et exhorte à des élections démocratiques,Kevin Aka,https://beninwebtv.com/author/kevin/,1 octobre 2024,"Le 30 septembre, en marge de la 79e session de l'Assemblée générale des Nations Unies à New York, le ministre des Affaires étrangères du...",Diplomatie,https://i0.wp.com/beninwebtv.com/wp-content/uploads/2024/10/Linda-Thomas-Greenfield.webp?resize=696%2C464&ssl=1,https://beninwebtv.com/mali-washington-renforce-son-soutien-et-exhorte-a-des-elections-democratiques/,Mali,,beninwebtv,fr,,
Mali: arrestation de quatre cadres de Barrick Gold,Kevin Aka,https://beninwebtv.com/author/kevin/,1 octobre 2024,"L'industrie minière malienne, pilier essentiel de l'économie nationale, traverse une crise sans précédent. L'arrestation, le 27 septembre dernier, de quatre employés maliens de la...",Société,https://i0.wp.com/beninwebtv.com/wp-content/uploads/2024/02/prison.webp?resize=696%2C391&ssl=1,https://beninwebtv.com/mali-arrestation-de-quatre-cadres-de-barrick-gold/,Mali,,beninwebtv,fr,,
Mali: la rentrée scolaire reportée en raison de l’état de catastrophe nationale,Kevin Aka,https://beninwebtv.com/author/kevin/,30 septembre 2024,"La rentrée scolaire, initialement prévue pour le 1er octobre, a été reportée au 4 novembre prochain, a déclaré ce lundi Amadou Sy Savané, ministre...",Education,https://i0.wp.com/beninwebtv.com/wp-content/uploads/2023/07/Affectation-en-ligne-des-eleves-en-classe-de-6%E1%B5%89-en-Cote-dIvoire-ce-quil-faut-savoir.jpg?resize=696%2C464&ssl=1,https://beninwebtv.com/mali-la-rentree-scolaire-reportee-en-raison-de-letat-de-catastrophe-nationale/,Mali,,beninwebtv,fr,,
Les séparatistes de l’Azawad soutiennent ouvertement le JNIM,padeguenon,https://beninwebtv.com/author/padeguenon/,30 septembre 2024,"Ces derniers jours, des informations ont circulé massivement sur les réseaux sociaux selon lesquelles les séparatistes de l'Azawad (CSP DPA) auraient publié un communiqué officiel...",Contribution,https://i0.wp.com/beninwebtv.com/wp-content/uploads/2024/09/Les-separatistes-de-lAzawad.webp?resize=696%2C390&ssl=1,https://beninwebtv.com/les-separatistes-de-lazawad-soutiennent-ouvertement-le-jnim/,Mali,,beninwebtv,fr,,
Mali: De nouveaux succès pour les FAMa dans la lutte contre le terrorisme,Leandro Zomassi,https://beninwebtv.com/author/libence/,30 septembre 2024,"Les Forces armées maliennes (FAMa) poursuivent leur offensive contre les groupes terroristes opérant sur le territoire national. Ces derniers jours, de nouvelles opérations ont...",Sécurité,https://i0.wp.com/beninwebtv.com/wp-content/uploads/2024/07/Assimi-Goita-1-1024x576-1.webp?resize=696%2C391&ssl=1,https://beninwebtv.com/mali-de-nouveaux-succes-pour-les-fama-dans-la-lutte-contre-le-terrorisme/,Mali,,beninwebtv,fr,,
Tensions diplomatiques : le Mali fustige l’ingérence algérienne à l’ONU,Kevin Aka,https://beninwebtv.com/author/kevin/,29 septembre 2024,"Le colonel Abdoulaye Maïga, ministre d’État et ministre de l'Administration territoriale du Mali, a profité de son intervention à la 79e session de l'Assemblée...",Diplomatie,https://i0.wp.com/beninwebtv.com/wp-content/uploads/2022/09/Abdoulaye-Mai%CC%88ga-ONU.jpeg?resize=696%2C464&ssl=1,https://beninwebtv.com/tensions-diplomatiques-le-mali-fustige-lingerence-algerienne-a-lonu/,Algérie,,beninwebtv,fr,,
"CEDEAO: Nana Akufo-Addo plaide pour la réintégration du Burkina, du Niger et du Mali",Leandro Zomassi,https://beninwebtv.com/author/libence/,5 octobre 2024,"Le président ghanéen Nana Akufo-Addo a profité de sa présence au 19e Sommet de la Francophonie, qui s'est ouvert ce vendredi 4 octobre à...",Politique,https://i0.wp.com/beninwebtv.com/wp-content/uploads/2024/10/Nana-Akufo-Addo-le-president-du-Ghana.webp?resize=696%2C464&ssl=1,https://beninwebtv.com/cedeao-nana-akufo-addo-plaide-pour-la-reintegration-du-burkina-du-niger-et-du-mali/,Burkina Faso,,beninwebtv,fr,,
L’AES franchit une étape clé vers un passeport unique et sécurisé,Kevin Aka,https://beninwebtv.com/author/kevin/,5 octobre 2024,"Les pays membres de l'Alliance des États du Sahel (AES) ont franchi une étape importante vers l'adoption d'un document de voyage unique, a déclaré...",Politique,https://i0.wp.com/beninwebtv.com/wp-content/uploads/2024/07/Tiani-Goita-et-Traore.webp?resize=696%2C464&ssl=1,https://beninwebtv.com/laes-franchit-une-etape-cle-vers-un-passeport-unique-et-securise/,Burkina Faso,,beninwebtv,fr,,
Niger : arrestation de 40 individus étrangers et saisie d’armes blanches par l’armée,Kevin Aka,https://beninwebtv.com/author/kevin/,3 octobre 2024,"Les Forces de défense et de sécurité (FDS) du Niger ont interpellé 40 individus, tous étrangers, à Tabarkat, dans la région d'Agadez (nord), et...",Sécurité,https://i0.wp.com/beninwebtv.com/wp-content/uploads/2023/12/prison-@-Doctissimo-1.webp?resize=696%2C392&ssl=1,https://beninwebtv.com/niger-arrestation-de-40-individus-etrangers-et-saisie-darmes-blanches-par-larmee/,Niger,,beninwebtv,fr,,
Niger : plus de 9.780 nouveaux cas de cancer chaque année,Kevin Aka,https://beninwebtv.com/author/kevin/,2 octobre 2024,"Au Niger, le ministre de la Santé publique, le médecin colonel major Garba Hakimi, a annoncé que chaque année, on recense 9.787 nouveaux cas...",Santé,https://i0.wp.com/beninwebtv.com/wp-content/uploads/2024/01/Cancer.webp?resize=696%2C464&ssl=1,https://beninwebtv.com/niger-plus-de-9-780-nouveaux-cas-de-cancer-chaque-annee/,Niger,,beninwebtv,fr,,
Niger : 162 kg de cannabis cachés dans un cortège de mariage saisis à Arlit,Kevin Aka,https://beninwebtv.com/author/kevin/,1 octobre 2024,Le Niger intensifie sa lutte contre le trafic de stupéfiants en saisissant 162 kg de cannabis. Cette intervention a été menée par l’Office central...,Société,https://i0.wp.com/beninwebtv.com/wp-content/uploads/2022/05/Drogue-saisie-au-Niger.jpg?resize=696%2C522&ssl=1,https://beninwebtv.com/niger-162-kg-de-cannabis-caches-dans-un-cortege-de-mariage-saisis-a-arlit/,Niger,,beninwebtv,fr,,
Niger: le ministre de l’Intérieur appelle à la mobilisation nationale contre les menaces de déstabilisation,Kevin Aka,https://beninwebtv.com/author/kevin/,1 octobre 2024,"Dans une déclaration rendue publique lundi, le ministre de l'Intérieur et de la Sécurité publique du Niger, le général de brigade Mohamed Toumba, a...",Politique,https://i0.wp.com/beninwebtv.com/wp-content/uploads/2024/10/Colonel-Mohamed-Toumba.jpg?resize=696%2C392&ssl=1,https://beninwebtv.com/niger-le-ministre-de-linterieur-appelle-a-la-mobilisation-nationale-contre-les-menaces-de-destabilisation/,Niger,,beninwebtv,fr,,
Diplomatie : rencontre entre les ministres des Affaires Étrangères du Bénin et du Niger,Kevin Aka,https://beninwebtv.com/author/kevin/,29 septembre 2024,"Le Ministre des Affaires Étrangères du Bénin, Shegun Adjadi Bakari, et son homologue nigérien, Bakary Yaou Sangaré, en charge des Affaires Étrangères, de la...",Diplomatie,https://i0.wp.com/beninwebtv.com/wp-content/uploads/2024/09/Bakari-Shegun-echange-avec-son-homologue-Bakary-Yaou-Sangare.jpg?resize=696%2C348&ssl=1,https://beninwebtv.com/diplomatie-rencontre-entre-les-ministres-des-affaires-etrangeres-du-benin-et-du-niger/,Bénin,,beninwebtv,fr,,
"Mali : une attaque ciblée pour saboter la Confédération AES, selon Tiani",Kevin Aka,https://beninwebtv.com/author/kevin/,20 septembre 2024,"Dans sa déclaration de soutien, le dirigeant nigérien Abdourahamane Tiani a exprimé au colonel Assimi Goïta, au gouvernement et au peuple malien ""ses plus...",Politique,https://i0.wp.com/beninwebtv.com/wp-content/uploads/2024/08/Tiani.webp?resize=696%2C392&ssl=1,https://beninwebtv.com/mali-une-attaque-ciblee-pour-saboter-la-confederation-aes-selon-tiani/,Mali,,beninwebtv,fr,,
Niger – Disparition du journaliste Serge Mathurin Adou : le gouvernement ivoirien réagit,Kevin Aka,https://beninwebtv.com/author/kevin/,20 septembre 2024,"Le gouvernement ivoirien a annoncé qu'il s'est saisi de l'affaire concernant la disparition du journaliste Serge Mathurin Adou, correspondant de Canal 3 à Niamey,...",Société,https://i0.wp.com/beninwebtv.com/wp-content/uploads/2024/09/Serges-Mathurin-Adou.jpg?resize=696%2C348&ssl=1,https://beninwebtv.com/niger-disparition-du-journaliste-serge-mathurin-adou-le-gouvernement-ivoirien-reagit/,Niger,,beninwebtv,fr,,
Niger : la rentrée scolaire reportée en raison de la situation pluviométrique,Kevin Aka,https://beninwebtv.com/author/kevin/,20 septembre 2024,"Le gouvernement du Niger a annoncé ce jeudi le report de la rentrée scolaire, initialement fixée au 2 octobre, au 28 octobre prochain, en...",Education,https://i0.wp.com/beninwebtv.com/wp-content/uploads/2023/07/Affectation-en-ligne-des-eleves-en-classe-de-6%E1%B5%89-en-Cote-dIvoire-ce-quil-faut-savoir.jpg?resize=696%2C464&ssl=1,https://beninwebtv.com/niger-la-rentree-scolaire-reportee-en-raison-de-la-situation-pluviometrique/,Niger,,beninwebtv,fr,,
Nigeria: plusieurs morts dans le naufrage d’un bateau,Leandro Zomassi,https://beninwebtv.com/author/libence/,3 octobre 2024,"Un naufrage tragique a eu lieu dans le centre-nord du Nigeria, sur le fleuve Niger, causant la mort d'au moins 36 personnes, selon les...",Société,https://i0.wp.com/beninwebtv.com/wp-content/uploads/2023/12/un-bateau-chavire.webp?resize=696%2C391&ssl=1,https://beninwebtv.com/nigeria-plusieurs-morts-dans-le-naufrage-dun-bateau/,Nigeria,,beninwebtv,fr,,
Nigéria: Bola Tinubu s’accorde deux semaines de vacances au Royaume-Uni,Kevin Aka,https://beninwebtv.com/author/kevin/,3 octobre 2024,"Le président nigérian, Bola Tinubu, a quitté Abuja mercredi pour le Royaume-Uni, où il passera deux semaines de congé annuel. Durant ces vacances de...",Politique,https://i0.wp.com/beninwebtv.com/wp-content/uploads/2023/11/Bola-Tinubu-1.webp?resize=696%2C465&ssl=1,https://beninwebtv.com/nigeria-bola-tinubu-saccorde-deux-semaines-de-vacances-au-royaume-uni/,Nigeria,,beninwebtv,fr,,
"Le Nigeria obtient un nouveau prêt de 1,57 milliard de dollars de la Banque mondiale",Kevin Aka,https://beninwebtv.com/author/kevin/,1 octobre 2024,"Le Nigeria a récemment obtenu un financement de 1,57 milliard de dollars de la Banque mondiale afin de renforcer le capital humain, en améliorant...",Economie,https://i0.wp.com/beninwebtv.com/wp-content/uploads/2023/11/Bola-Tinubu-1.webp?resize=696%2C465&ssl=1,https://beninwebtv.com/le-nigeria-obtient-un-nouveau-pret-de-157-milliard-de-dollars-de-la-banque-mondiale/,Nigeria,,beninwebtv,fr,,
Nigeria: le sélectionneur Augustine Eguavoen confirmé à son poste,Romaric Déguénon,https://beninwebtv.com/author/romaric/,27 septembre 2024,"Intérimaire lors des deux premières journées des éliminatoires de la CAN 2025, Augustine Eguavoen a été confirmé à son poste de sélectionneur national des...",Afrique – Sport,https://i0.wp.com/beninwebtv.com/wp-content/uploads/2024/09/Augustine_Eguavoengh.webp?resize=696%2C463&ssl=1,https://beninwebtv.com/nigeria-le-selectionneur-augustine-eguavoen-confirme-a-son-poste/,Nigeria,,beninwebtv,fr,,
Nigeria: Coca-Cola injecte un milliard de dollars dans ses activités,Kevin Aka,https://beninwebtv.com/author/kevin/,21 septembre 2024,"Le Nigeria, en proie à une grave crise économique et désireux d'attirer les multinationales, reçoit une annonce de taille : Coca-Cola prévoit d'investir un...",Société,https://i0.wp.com/beninwebtv.com/wp-content/uploads/2024/08/Coca-Cola.jpg?resize=696%2C348&ssl=1,https://beninwebtv.com/nigeria-coca-cola-injecte-un-milliard-de-dollars-dans-ses-activites/,Nigeria,,beninwebtv,fr,,
Terrorisme au Nigeria: l’armée élimine 4 bandits et sauve des otages,Kevin Aka,https://beninwebtv.com/author/kevin/,18 septembre 2024,"Au Nigeria, au moins quatre bandits ont été abattus et 20 otages libérés mardi par les forces nigérianes lors de raids antiterroristes distincts dans...",Société,https://i0.wp.com/beninwebtv.com/wp-content/uploads/2021/08/Attaques-terroristes-au-Burkina-1.png?resize=696%2C427&ssl=1,https://beninwebtv.com/terrorisme-au-nigeria-larmee-elimine-4-bandits-et-sauve-des-otages/,Nigeria,,beninwebtv,fr,,
Nigeria: Bola Tinubu confirme la mort de 40 personnes dans un accident de route,Kevin Aka,https://beninwebtv.com/author/kevin/,18 septembre 2024,"Au début de la semaine, une collision entre une voiture et un camion dans l'État de Kaduna, au nord-ouest du Nigeria, a fait au...",Société,https://i0.wp.com/beninwebtv.com/wp-content/uploads/2022/06/Bola-Tinubu.jpg?resize=696%2C392&ssl=1,https://beninwebtv.com/nigeria-bola-tinubu-confirme-la-mort-de-40-personnes-dans-un-accident-de-route/,Nigeria,,beninwebtv,fr,,
Nigeria: des inondations provoquent l’évasion de 281 prisonniers dans le nord-est du pays,Kevin Aka,https://beninwebtv.com/author/kevin/,16 septembre 2024,"La semaine dernière, plus de 280 détenus se sont échappés d'une prison du nord du Nigeria après que des inondations ont provoqué l'effondrement de...",Société,https://i0.wp.com/beninwebtv.com/wp-content/uploads/2024/02/prison.webp?resize=696%2C391&ssl=1,https://beninwebtv.com/nigeria-des-inondations-provoquent-levasion-de-281-prisonniers-dans-le-nord-est-du-pays/,Nigeria,,beninwebtv,fr,,
Nigeria: la raffinerie Dangote entame l’approvisionnement du pays en essence,Kevin Aka,https://beninwebtv.com/author/kevin/,16 septembre 2024,"Les premiers camions-citernes transportant de l'essence ont quitté, le 15 septembre 2024, la raffinerie du milliardaire Aliko Dangote, marquant ainsi un tournant pour le...",Société,https://i0.wp.com/beninwebtv.com/wp-content/uploads/2023/05/Dangote-refinery-e1631537215788.jpg?resize=696%2C392&ssl=1,https://beninwebtv.com/nigeria-la-raffinerie-dangote-entame-lapprovisionnement-du-pays-en-essence/,Nigeria,,beninwebtv,fr,,
"Terrorisme: trois Béninois kidnappés au Nigeria, une rançon exigée",Romaric Déguénon,https://beninwebtv.com/author/romaric/,16 septembre 2024,"Trois Béninois ont été enlevés par de présumés terroristes au Nigeria alors qu'ils rentraient au pays par la frontière qui traverse les deux nations,...",Société,https://i0.wp.com/beninwebtv.com/wp-content/uploads/2024/09/Terrorisme-2-1024x767-1.webp?resize=696%2C521&ssl=1,https://beninwebtv.com/terrorisme-trois-beninois-kidnappes-au-nigeria-une-rancon-exigee/,Bénin,,beninwebtv,fr,,
CAN 2025 (Q): la liste du Sénégal face au Malawi,Romaric Déguénon,https://beninwebtv.com/author/romaric/,4 octobre 2024,"La Fédération sénégalaise de football a publié la liste des joueurs retenus pour la double confrontation face au Malawi en ce mois d'octobre, comptant...",Afrique – Sport,https://i0.wp.com/beninwebtv.com/wp-content/uploads/2024/01/CAN-2023-Senegal-les-lions-de-la-Teranga-frappes-par-un-malheur.webp?resize=696%2C371&ssl=1,https://beninwebtv.com/can-2025-q-la-liste-du-senegal-face-au-malawi/,Sénégal,,beninwebtv,fr,,
Sénégal : voici l’équipe désignée pour succéder temporairement à Aliou Cissé,Kevin Aka,https://beninwebtv.com/author/kevin/,4 octobre 2024,"En attendant de désigner le successeur définitif d'Aliou Cissé à la tête de l'équipe nationale sénégalaise, une équipe intérimaire a été mise en place...",Afrique – Sport,https://i0.wp.com/beninwebtv.com/wp-content/uploads/2022/06/Aliou-Cisse.jpg?resize=696%2C434&ssl=1,https://beninwebtv.com/senegal-voici-lequipe-designee-pour-succeder-temporairement-a-aliou-cisse/,Sénégal,,beninwebtv,fr,,
Sénégal: Sadio Mané réagit au départ d’Aliou Cissé,Romaric Déguénon,https://beninwebtv.com/author/romaric/,3 octobre 2024,"A l'instar de la communauté sportive, Sadio Mané a également réagi au départ d'Aliou Cissé, non reconduit à son poste de sélectionneur du Sénégal...",Afrique – Sport,https://i0.wp.com/beninwebtv.com/wp-content/uploads/2024/01/Alou.webp?resize=696%2C464&ssl=1,https://beninwebtv.com/senegal-sadio-mane-reagit-au-depart-daliou-cisse/,Sénégal,,beninwebtv,fr,,
Aliou Cissé n’est plus le sélectionneur du Sénégal,Romaric Déguénon,https://beninwebtv.com/author/romaric/,2 octobre 2024,"Vainqueur de la CAN 2021 avec le Sénégal, Aliou Cissé ne continuera pas sur le banc des Lions de la Téranga. Le technicien...",Afrique – Sport,https://i0.wp.com/beninwebtv.com/wp-content/uploads/2024/01/Alou.webp?resize=696%2C464&ssl=1,https://beninwebtv.com/aliou-cisse-nest-plus-le-selectionneur-du-senegal/,Sénégal,,beninwebtv,fr,,
Sénégal: interpellation du chroniqueur Kader Dia,Aya N'goran,https://beninwebtv.com/author/aya/,1 octobre 2024,"Kader Dia, chroniqueur à la SEN TV a été arrêté ce lundi 30 septembre 2024. Il a été placé en garde en vue, après...",Société,https://i0.wp.com/beninwebtv.com/wp-content/uploads/2024/10/Kader-Dia.webp?resize=696%2C389&ssl=1,https://beninwebtv.com/senegal-interpellation-du-chroniqueur-kader-dia/,Sénégal,,beninwebtv,fr,,
"Sénégal: Macky Sall, figure de proue de l’opposition pour les législatives anticipées",Kevin Aka,https://beninwebtv.com/author/kevin/,1 octobre 2024,"L’ancien président sénégalais, Macky Sall, fait un retour marquant sur la scène politique en étant désigné pour conduire la liste principale de l’opposition lors...",Politique,https://i0.wp.com/beninwebtv.com/wp-content/uploads/2024/02/Macky-Sall.webp?resize=696%2C348&ssl=1,https://beninwebtv.com/senegal-macky-sall-figure-de-proue-de-lopposition-pour-les-legislatives-anticipees/,Sénégal,,beninwebtv,fr,,
Sénégal : Diéguy Diop attendue à la Division des investigations criminelles,Kevin Aka,https://beninwebtv.com/author/kevin/,1 octobre 2024,"Au Sénégal, Diéguy Diop, ex-directrice de la Promotion de l'économie sociale et solidaire, a annoncé à Seneweb qu'elle se présentera à la Division des...",Politique,https://i0.wp.com/beninwebtv.com/wp-content/uploads/2024/10/Dieguy-Diop.jpg?resize=696%2C522&ssl=1,https://beninwebtv.com/senegal-dieguy-diop-attendue-a-la-division-des-investigations-criminelles/,Sénégal,,beninwebtv,fr,,
Togo – Agression de Guy Marius Sagna : le Sénégal sort enfin du silence,Kevin Aka,https://beninwebtv.com/author/kevin/,30 septembre 2024,"Le 29 septembre 2024, Guy Marius Sagna, député sénégalais et représentant à la Communauté économique des États de l'Afrique de l'Ouest (Cédéao), a été...",Politique,https://i0.wp.com/beninwebtv.com/wp-content/uploads/2024/07/Guy-Marius-Sagna.jpg?resize=696%2C348&ssl=1,https://beninwebtv.com/togo-agression-de-guy-marius-sagna-le-senegal-sort-enfin-du-silence/,Sénégal,,beninwebtv,fr,,
Sénégal : l’ex-ministre Lat Diop placé en détention pour détournement de fonds,Kevin Aka,https://beninwebtv.com/author/kevin/,28 septembre 2024,"Au Sénégal, Lat Diop est l'un des premiers hauts responsables de l'ère Macky Sall à être poursuivi pour des infractions économiques, et le premier...",Politique,https://i0.wp.com/beninwebtv.com/wp-content/uploads/2024/08/Lat-Diop.webp?resize=696%2C392&ssl=1,https://beninwebtv.com/senegal-lex-ministre-lat-diop-place-en-detention-pour-detournement-de-fonds/,Sénégal,,beninwebtv,fr,,
Sénégal : Ousmane Sonko dénonce une situation financière critique,Kevin Aka,https://beninwebtv.com/author/kevin/,27 septembre 2024,"Suite à la présentation de l’état des finances publiques par le ministre de l’Économie, le Premier ministre sénégalais, Ousmane Sonko, a critiqué « la...",Economie,https://i0.wp.com/beninwebtv.com/wp-content/uploads/2023/01/photo_1660846882.jpg?resize=696%2C425&ssl=1,https://beninwebtv.com/senegal-ousmane-sonko-denonce-une-situation-financiere-critique/,Sénégal,,beninwebtv,fr,,
Sierra Leone : arrestation de quatre étrangers après l’atterrissage non autorisé d’un avion à Freetown,Kevin Aka,https://beninwebtv.com/author/kevin/,21 septembre 2024,"Le gouvernement sierra-léonais, par l'intermédiaire de l'Autorité de l'Aviation Civile de la Sierra Leone (SLCAA), a annoncé l'arrestation de quatre individus à bord d'un...",Société,https://i0.wp.com/beninwebtv.com/wp-content/uploads/2023/12/prison-@-Doctissimo-1.webp?resize=696%2C392&ssl=1,https://beninwebtv.com/sierra-leone-arrestation-de-quatre-etrangers-apres-latterrissage-non-autorise-dun-avion-a-freetown/,Sierra Leone,,beninwebtv,fr,,
Sierra Leone : 11 personnes condamnées pour tentative de coup d’État,Casimir Vodjo,https://beninwebtv.com/author/benjamin/,23 juillet 2024,"En Sierra Leone, 11 personnes ont été lourdement condamnées pour leur implication dans une tentative de coup d'État contre le gouvernement de Freetown en...",Politique,https://i0.wp.com/beninwebtv.com/wp-content/uploads/2022/02/Justice.jpeg?resize=696%2C392&ssl=1,https://beninwebtv.com/sierra-leone-11-personnes-condamnees-pour-tentative-de-coup-detat/,Sierra Leone,,beninwebtv,fr,,
CDM 2026 (Q): la liste de la Sierra Leone face à Djibouti et le Burkina Faso,Romaric Déguénon,https://beninwebtv.com/author/romaric/,28 mai 2024,"Le sélectionneur national de la Sierra Leone, Amidu Karim, a dévoilé ce mardi la liste des Leone Stars retenus pour les matchs face au...",Football,https://i0.wp.com/beninwebtv.com/wp-content/uploads/2023/11/Sierra-Leone.webp?resize=696%2C392&ssl=1,https://beninwebtv.com/cdm-2026-q-la-liste-de-la-sierra-leone-face-a-djibouti-et-le-burkina-faso/,Sierra Leone,,beninwebtv,fr,,
"Coco Emilia : son ex Francis Mvemba retrouvé dans un commissariat, après sa disparition",Claudia DIANOU,https://beninwebtv.com/author/claudia-dianou/,29 mars 2024,"Disparu et annoncé mort il y a quelques jours, l’homme d’affaire congolais et ex-mari de Coco Emilia, Francis Mvemba a été retrouvé dans un...",Célébrité,https://i0.wp.com/beninwebtv.com/wp-content/uploads/2022/08/Francis-Mvemba-et-Coco-Emilia-@-Montage.jpg?resize=696%2C464&ssl=1,https://beninwebtv.com/coco-emilia-son-ex-francis-mvemba-retrouve-dans-un-commissariat-apres-sa-disparition/,RD Congo,,beninwebtv,fr,,
CAN 2023 : El Hadji Diouf s’attire la foudre de Lady Ponce,Claudia DIANOU,https://beninwebtv.com/author/claudia-dianou/,22 janvier 2024,"L’ancien joueur sénégalais, El Hadji Diouf a récemment fait une sortie médiatique, dans laquelle, il critiquait le Cameroun. N’ayant pas apprécié cette sortie de...",Célébrité,https://i0.wp.com/beninwebtv.com/wp-content/uploads/2024/01/Lady-Ponce-et-El-Hadji-Diouf.webp?resize=696%2C348&ssl=1,https://beninwebtv.com/can-2023-el-hadji-diouf-sattire-la-foudre-de-lady-ponce/,Cameroun,,beninwebtv,fr,,
Sierra Leone – Tentative de coup d’Etat: le Nigéria offre l’asile à l’ex-président Ernest Koroma,Romaric Déguénon,https://beninwebtv.com/author/romaric/,4 janvier 2024,"Selon la presse ghanéenne, l'ancien président de la Sierra Leone, Ernest Bai Koroma, devrait arriver ce jeudi au Nigeria après avoir obtenu l'asile politique...",Politique,https://i0.wp.com/beninwebtv.com/wp-content/uploads/2023/12/54360977_sierra_koroma_afp.webp?resize=696%2C391&ssl=1,https://beninwebtv.com/sierra-leone-tentative-de-coup-detat-le-nigeria-offre-lasile-a-lex-president-ernest-koroma/,Sierra Leone,,beninwebtv,fr,,
Sierra Leone – Tentative de coup d’Etat: l’ex-président Ernest Koroma inculpé,Vincent DEGUENON,https://beninwebtv.com/author/arnaud/,4 janvier 2024,"Déjà assigné à résidence depuis le 9 décembre, l’ancien chef de l’État est soupçonné d’avoir joué un rôle dans une « tentative de coup d’État »...",Politique,https://i0.wp.com/beninwebtv.com/wp-content/uploads/2023/12/54360977_sierra_koroma_afp.webp?resize=696%2C391&ssl=1,https://beninwebtv.com/sierra-leone-tentative-de-coup-detat-lex-president-ernest-koroma-inculpe/,Sierra Leone,,beninwebtv,fr,,
Tentative de coup d’Etat en Sierra Leone: 80 suspects dont l’ancien président arrêtés,Romaric Déguénon,https://beninwebtv.com/author/romaric/,15 décembre 2023,La traque à la tentative de coup d'Etat en Sierra Leone en fin novembre dernier a permis aux autorités de mettre la main sur...,Société,https://i0.wp.com/beninwebtv.com/wp-content/uploads/2023/12/54360977_sierra_koroma_afp.webp?resize=696%2C391&ssl=1,https://beninwebtv.com/tentative-de-coup-detat-en-sierra-leone-80-suspects-dont-lancien-president-arretes/,Sierra Leone,,beninwebtv,fr,,
Une délégation de haut niveau de la CEDEAO en Sierra Leone après la tentative de coup d’Etat,Casimir Vodjo,https://beninwebtv.com/author/benjamin/,1 décembre 2023,"En Sierra Leone, des individus armés ont pris pour cible, le dimanche 26 novembre, une armurerie militaire, deux autres casernes, deux prisons et...",Diplomatie,https://i0.wp.com/beninwebtv.com/wp-content/uploads/2022/04/CEDEAO-@-AA.jpg?resize=696%2C392&ssl=1,https://beninwebtv.com/une-delegation-de-haut-niveau-de-la-cedeao-en-sierra-leone-apres-la-tentative-de-coup-detat/,Sierra Leone,,beninwebtv,fr,,
