title,author_name,author_url,publication_date,description,category,image_url,url,countries,content_preview,source,lang,content,source_name
Mondial 2026: Steve Mounié rêve d’une qualification historique avec le Bénin,Romaric Déguénon,https://beninwebtv.com/author/romaric/,5 octobre 2024,"Moteur principal de l'équipe nationale du Bénin, Steve Mounié ambitionne de conduire les Guépards à la phase finale de la Coupe du monde 2026,...",Football,https://i0.wp.com/beninwebtv.com/wp-content/uploads/2024/06/mounie.webp?resize=696%2C457&ssl=1,https://beninwebtv.com/mondial-2026-steve-mounie-reve-dune-qualification-historique-avec-le-benin/,Bénin,,beninwebtv,fr,,
Elim CAN 2025: liste des Guépards du Bénin convoqués contre le Rwanda,Angèle M. ADANLE,https://beninwebtv.com/author/angele/,5 octobre 2024,"La fédération Béninoise de Football a publié sur sa page Facebook dans la matinée de ce samedi 5 octobre 2024, la liste des 25...",Bénin – Sport,https://i0.wp.com/beninwebtv.com/wp-content/uploads/2023/10/Guepards-1.webp?resize=696%2C386&ssl=1,https://beninwebtv.com/elim-can-2025-liste-des-guepards-du-benin-convoques-contre-le-rwanda/,Bénin,,beninwebtv,fr,,
"Bénin: Suppression des Soutenances à la FLLAC, voici les dispositions transitoires",Angèle M. ADANLE,https://beninwebtv.com/author/angele/,4 octobre 2024,"Il n'y aura plus de soutenance de mémoire à la Faculté des Lettres, Langues, Art et Communication (FLLAC). Ainsi en a décidé le doyen...",Ecoles - Formations,https://i0.wp.com/beninwebtv.com/wp-content/uploads/2022/06/Universite-dAbomey-Calavi.jpg?resize=696%2C392&ssl=1,https://beninwebtv.com/benin-suppression-des-soutenances-a-la-fllac-voici-les-dispositions-transitoires/,Bénin,,beninwebtv,fr,,
Bénin: l’artiste Vano Baby nominé aux PRIMUD 2024,Angèle M. ADANLE,https://beninwebtv.com/author/angele/,4 octobre 2024,Le rappeur béninois Vano Baby a été nominé aux PRIMUD 2024. Sa nomination lui a été notifiée dans l'après midi de ce vendredi 4...,Showbiz,https://i0.wp.com/beninwebtv.com/wp-content/uploads/2023/03/Vano-Baby-1.jpg?resize=696%2C496&ssl=1,https://beninwebtv.com/benin-lartiste-vano-baby-nomine-aux-primud-2024/,Bénin,,beninwebtv,fr,,
Bénin : des civils tués par des individus armés non identifiés à Karimama,Kevin Aka,https://beninwebtv.com/author/kevin/,4 octobre 2024,"Dans la nuit du 3 au 4 octobre 2024, des civils de la commune de Karimama, située dans le nord du Bénin, ont été...",Sécurité,https://i0.wp.com/beninwebtv.com/wp-content/uploads/2024/09/Terrorisme-2-1024x767-1.webp?resize=696%2C521&ssl=1,https://beninwebtv.com/benin-des-civils-tues-par-des-individus-armes-non-identifies-a-karimama/,Bénin,,beninwebtv,fr,,
Bénin: le MPL se prononce sur le coup d’Etat déjoué contre Patrice Talon,Edouard Djogbénou,https://beninwebtv.com/author/edouard/,4 octobre 2024,Le Mouvement Populaire de Libération (MPL) a condamné les tentatives de coup d'État au Bénin et a exhorté les gouvernants à prendre en compte...,Politique,https://i0.wp.com/beninwebtv.com/wp-content/uploads/2022/04/Experience-Tebe.jpg?resize=696%2C522&ssl=1,https://beninwebtv.com/benin-le-mpl-se-prononce-sur-le-coup-detat-dejoue-contre-patrice-talon/,Bénin,,beninwebtv,fr,,
Coup d’état déjoué au Bénin: les 4 recommandations du parti Les Démocrates à Patrice Talon,Angèle M. ADANLE,https://beninwebtv.com/author/angele/,3 octobre 2024,"Lors d'un point de presse animé ce jeudi 3 octobre 2024 en réponse au coup d'état déjoué au Bénin, le parti Les Démocrates a...",Politique,https://i0.wp.com/beninwebtv.com/wp-content/uploads/2024/10/Oswald-Homeky-Colonel-Djimon-Dieudonne-Tevoedjre-et-Olivier-Boko-1.jpg?resize=696%2C439&ssl=1,https://beninwebtv.com/coup-detat-dejoue-au-benin-les-4-recommandations-du-parti-les-democrates-a-patrice-talon/,Bénin,,beninwebtv,fr,,
Budget de l’éducation : Ces actions en faveur des enfants en 2024,Ousmane Traoré Samba,https://beninwebtv.com/author/2250143010806/,3 octobre 2024,"Pour 2024 et les années subséquentes, le gouvernement veut assurer « la couverture intégrale de la prise en charge des frais d’écolage des enfants...",Société,https://i0.wp.com/beninwebtv.com/wp-content/uploads/2024/10/Education-au-Benin.webp?resize=696%2C464&ssl=1,https://beninwebtv.com/budget-de-leducation-ces-actions-en-faveur-des-enfants-en-2024/,Bénin,,beninwebtv,fr,,
Coton : le Bénin frôle les 600 000 tonnes en 2024 ,Ousmane Traoré Samba,https://beninwebtv.com/author/2250143010806/,3 octobre 2024,"Sous réserve des dernières tonnes en provenance des champs, le Bénin peut se targuer d’avoir produit environ 598.000 tonnes de cotons graines pour le...",Economie,https://i0.wp.com/beninwebtv.com/wp-content/uploads/2024/10/Cotonou-du-Benin.webp?resize=696%2C391&ssl=1,https://beninwebtv.com/coton-le-benin-frole-les-600-000-tonnes-en-2024/,Bénin,,beninwebtv,fr,,
"Le Bénin, désormais pays producteur et exportateur de mangue industrielle",Ousmane Traoré Samba,https://beninwebtv.com/author/2250143010806/,3 octobre 2024,Le Bénin a élargi sa gamme de produits industriels prêts à l’exportation. La mangue béninoise va désormais à la conquête du monde dans sa...,Economie,https://i0.wp.com/beninwebtv.com/wp-content/uploads/2024/10/image-8.png?resize=696%2C522&ssl=1,https://beninwebtv.com/le-benin-desormais-pays-producteur-et-exportateur-de-mangue-industrielle/,Bénin,,beninwebtv,fr,,
Burkina Faso – Extradition de Paul Henri Damiba: Ibrahim Traoré intensifie les négociations avec Lomé,Kevin Aka,https://beninwebtv.com/author/kevin/,5 octobre 2024,"L'ancien président Paul Henri Damiba pourrait bientôt être extradé vers le Burkina Faso. Le capitaine Ibrahim Traoré, actuel dirigeant du pays, a entamé des...",Politique,https://i0.wp.com/beninwebtv.com/wp-content/uploads/2022/09/Paul-Henri-Damiba.jpg?resize=696%2C464&ssl=1,https://beninwebtv.com/burkina-faso-extradition-de-paul-henri-damiba-ibrahim-traore-intensifie-les-negociations-avec-lome/,Burkina Faso,,beninwebtv,fr,,
Burkina Faso : trois officiers radiés pour absence injustifiée,Kevin Aka,https://beninwebtv.com/author/kevin/,5 octobre 2024,"Au Burkina Faso, trois hauts responsables des Forces armées nationales ont été exclus des rangs de l'armée en raison d'une absence non autorisée de...",Sécurité,https://i0.wp.com/beninwebtv.com/wp-content/uploads/2021/06/Soldats-burkinabe-1.jpg?resize=696%2C464&ssl=1,https://beninwebtv.com/burkina-faso-trois-officiers-radies-pour-absence-injustifiee/,Burkina Faso,,beninwebtv,fr,,
"CEDEAO: Nana Akufo-Addo plaide pour la réintégration du Burkina, du Niger et du Mali",Leandro Zomassi,https://beninwebtv.com/author/libence/,5 octobre 2024,"Le président ghanéen Nana Akufo-Addo a profité de sa présence au 19e Sommet de la Francophonie, qui s'est ouvert ce vendredi 4 octobre à...",Politique,https://i0.wp.com/beninwebtv.com/wp-content/uploads/2024/10/Nana-Akufo-Addo-le-president-du-Ghana.webp?resize=696%2C464&ssl=1,https://beninwebtv.com/cedeao-nana-akufo-addo-plaide-pour-la-reintegration-du-burkina-du-niger-et-du-mali/,Burkina Faso,,beninwebtv,fr,,
L’AES franchit une étape clé vers un passeport unique et sécurisé,Kevin Aka,https://beninwebtv.com/author/kevin/,5 octobre 2024,"Les pays membres de l'Alliance des États du Sahel (AES) ont franchi une étape importante vers l'adoption d'un document de voyage unique, a déclaré...",Politique,https://i0.wp.com/beninwebtv.com/wp-content/uploads/2024/07/Tiani-Goita-et-Traore.webp?resize=696%2C464&ssl=1,https://beninwebtv.com/laes-franchit-une-etape-cle-vers-un-passeport-unique-et-securise/,Burkina Faso,,beninwebtv,fr,,
Ibrahim Traoré: « La trahison deviendra désormais le crime le plus grave »,Kevin Aka,https://beninwebtv.com/author/kevin/,3 octobre 2024,"À l'occasion de la 2ᵉ Journée nationale d’engagement patriotique, le président du Faso, le capitaine Ibrahim Traoré, a vigoureusement dénoncé la trahison, qu'il a...",Politique,https://i0.wp.com/beninwebtv.com/wp-content/uploads/2023/07/Ibrahim-Traore.jpg?resize=696%2C491&ssl=1,https://beninwebtv.com/ibrahim-traore-la-trahison-deviendra-desormais-le-crime-le-plus-grave/,Burkina Faso,,beninwebtv,fr,,
Le Burkina Faso interdit « the Bachelor » pour atteinte à l’image de la femme africaine,Kevin Aka,https://beninwebtv.com/author/kevin/,2 octobre 2024,"La téléréalité ""The Bachelor"" est désormais interdite au Burkina Faso, selon un rapport de l'Agence d'information du Burkina (AIB) publié le mercredi 2 octobre...",Société,https://i0.wp.com/beninwebtv.com/wp-content/uploads/2024/10/Conseil-superieur-de-la-Communication-CSC.jpg?resize=696%2C348&ssl=1,https://beninwebtv.com/le-burkina-faso-interdit-the-bachelor-pour-atteinte-a-limage-de-la-femme-africaine/,Burkina Faso,,beninwebtv,fr,,
Burkina Faso: des forces armées neutralisent des terroristes lors d’opérations coordonnées,Kevin Aka,https://beninwebtv.com/author/kevin/,2 octobre 2024,"En septembre dernier, plusieurs terroristes ont été ""neutralisés"" lors d'opérations antiterroristes menées par l'armée burkinabè dans diverses régions du pays, selon des sources de...",Société,https://i0.wp.com/beninwebtv.com/wp-content/uploads/2022/04/Societe-1.png?resize=696%2C398&ssl=1,https://beninwebtv.com/burkina-faso-des-forces-armees-neutralisent-des-terroristes-lors-doperations-coordonnees/,Burkina Faso,,beninwebtv,fr,,
Burkina Faso : le gouvernement dévoile des preuves de la dernière tentative de déstabilisation,Kevin Aka,https://beninwebtv.com/author/kevin/,30 septembre 2024,"Le 23 septembre 2024, le ministre de la Sécurité, Mahamadou Sana, a révélé un complot d'envergure visant à compromettre la sûreté de l'État. Le...",Politique,https://i0.wp.com/beninwebtv.com/wp-content/uploads/2022/10/000_32KL379.jpg?resize=696%2C392&ssl=1,https://beninwebtv.com/burkina-faso-le-gouvernement-devoile-des-preuves-de-la-derniere-tentative-de-destabilisation/,Burkina Faso,,beninwebtv,fr,,
Air Burkina se relance avec un nouvel avion en provenance de Chine,Kevin Aka,https://beninwebtv.com/author/kevin/,30 septembre 2024,"La compagnie nationale Air Burkina a annoncé, le samedi 28 septembre 2024, l’acquisition d’un nouvel avion, marquant ainsi son retour dans le ciel burkinabé. «...",Société,https://i0.wp.com/beninwebtv.com/wp-content/uploads/2024/02/Air-Burkina.webp?resize=696%2C370&ssl=1,https://beninwebtv.com/air-burkina-se-relance-avec-un-nouvel-avion-en-provenance-de-chine/,Burkina Faso,,beninwebtv,fr,,
Burkina Faso : le gouvernement retire les fréquences de RFI dans plusieurs grandes villes,Kevin Aka,https://beninwebtv.com/author/kevin/,28 septembre 2024,"Le Conseil supérieur de la Communication (CSC) a annoncé, ce vendredi 27 septembre 2024, le retrait de cinq fréquences de Radio France Internationale (RFI),...",Société,https://i0.wp.com/beninwebtv.com/wp-content/uploads/2022/04/RFI_TW.png?resize=696%2C392&ssl=1,https://beninwebtv.com/burkina-faso-le-gouvernement-retire-les-frequences-de-rfi-dans-plusieurs-grandes-villes/,Burkina Faso,,beninwebtv,fr,,
Côte d’Ivoire: Adama Bictogo rencontre le Président du Cap-Vert,Kevin Aka,https://beninwebtv.com/author/kevin/,14 juin 2024,"Le jeudi 13 juin 2024, le président de la République du Cap-Vert, Dr José Maria Pereira Neves, a accueilli au palais présidentiel le président...",Diplomatie,https://i0.wp.com/beninwebtv.com/wp-content/uploads/2024/06/Adama-Bictogo-et-Dr-Jose-Maria-Pereira-Neves.jpg?resize=696%2C348&ssl=1,https://beninwebtv.com/cote-divoire-adama-bictogo-rencontre-le-president-du-cap-vert/,Cap-Vert,,beninwebtv,fr,,
Mondial 2026 (Q): le Cameroun écrase le Cap-Vert,Romaric Déguénon,https://beninwebtv.com/author/romaric/,8 juin 2024,"Le Cameroun a pris la tête de la poule D après sa victoire écrasante face au Cap-Vert (4-1) ce samedi, à l'occasion de la...",Football,https://i0.wp.com/beninwebtv.com/wp-content/uploads/2024/05/cameroun-1.webp?resize=696%2C464&ssl=1,https://beninwebtv.com/mondial-2026-q-le-cameroun-ecrase-le-cap-vert/,Cameroun,,beninwebtv,fr,,
Cameroun-Cap-Vert: les compos officielles,Romaric Déguénon,https://beninwebtv.com/author/romaric/,8 juin 2024,Le Cameroun reçoit le Cap-Vert ce samedi après-midi pour le compte des éliminatoires de la Coupe du monde 2026. Les compos officielles à découvrir....,Football,https://i0.wp.com/beninwebtv.com/wp-content/uploads/2024/01/Andre_Onana.webp?resize=696%2C392&ssl=1,https://beninwebtv.com/cameroun-cap-vert-les-compos-officielles/,Cameroun,,beninwebtv,fr,,
"«Nous sommes apolitiques et le staff et les joueurs», Marc Brys avant Cameroun-Cap-Vert",Romaric Déguénon,https://beninwebtv.com/author/romaric/,8 juin 2024,"En conférence de presse vendredi, Marc Brys s'est exprimé sur le match Cameroun-Cap-Vert ce samedi, comptant pour la 3è journée des éliminatoires de la...",Football,https://i0.wp.com/beninwebtv.com/wp-content/uploads/2024/05/marc-vseto-1024x577-1.webp?resize=696%2C392&ssl=1,https://beninwebtv.com/nous-sommes-apolitiques-et-le-staff-et-les-joueurs-marc-brys-avant-cameroun-cap-vert/,Cameroun,,beninwebtv,fr,,
"Cap-Vert: avec Bébé, la liste des Requins Bleus contre le Cameroun et la Libye",Romaric Déguénon,https://beninwebtv.com/author/romaric/,23 mai 2024,"La Fédération Cap-verdienne de Football a annoncé ce jeudi 23 mai, la liste officielle des joueurs retenus pour affronter le Cameroun et la Libye...",Football,https://i0.wp.com/beninwebtv.com/wp-content/uploads/2024/05/bebe-1.webp?resize=696%2C371&ssl=1,https://beninwebtv.com/cap-vert-avec-bebe-la-liste-des-requins-bleus-contre-le-cameroun-et-la-libye/,Cap-Vert,,beninwebtv,fr,,
"Tournoi FIFA Series: le Cap-Vert s’offre le Guyana, l’Afrique du Sud accroché",Romaric Déguénon,https://beninwebtv.com/author/romaric/,22 mars 2024,"Le Cap-Vert a disposé du Guyana (1-0) en amical, jeudi en Arabie Saoudite, pour sa premier match du tournoi FIFA Series. En Algérie, l'Afrique...",Football,https://i0.wp.com/beninwebtv.com/wp-content/uploads/2024/01/centrafrique-cap-vert.webp?resize=696%2C392&ssl=1,https://beninwebtv.com/tournoi-fifa-series-le-cap-vert-soffre-le-guyana-lafrique-du-sud-accroche/,Afrique du Sud,,beninwebtv,fr,,
"CAN 2023: l’Afrique du Sud, dernière qualifiée pour les demi-finales",Romaric Déguénon,https://beninwebtv.com/author/romaric/,4 février 2024,L'Afrique du Sud a composté le dernier billet qualificatif pour les demi-finales de la CAN 2023 après sa victoire face au Cap-Vert aux tirs...,Afrique – Sport,https://i0.wp.com/beninwebtv.com/wp-content/uploads/2023/10/FA-1.webp?resize=696%2C433&ssl=1,https://beninwebtv.com/can-2023-lafrique-du-sud-derniere-qualifiee-pour-les-demi-finales/,Afrique du Sud,,beninwebtv,fr,,
CAN 2023: bonne nouvelle pour le Cap-Vert avant le choc contre l’Afrique du Sud,Romaric Déguénon,https://beninwebtv.com/author/romaric/,3 février 2024,"Le Cap-Vert a signé le retour de ses cadres Ryan Mendes et Steven Moreira, blessés à l'entrainement, alors que les Requins Bleus affrontent l'Afrique...",Afrique – Sport,https://i0.wp.com/beninwebtv.com/wp-content/uploads/2024/01/centrafrique-cap-vert.webp?resize=696%2C392&ssl=1,https://beninwebtv.com/can-2023-bonne-nouvelle-pour-le-cap-vert-avant-le-choc-contre-lafrique-du-sud/,Cap-Vert,,beninwebtv,fr,,
CAN 2023: le Cap-Vert surclasse la Mauritanie et file en quart de finale,Romaric Déguénon,https://beninwebtv.com/author/romaric/,29 janvier 2024,Le Cap-Vert a validé son ticket pour les quarts de finale de la CAN 2023 après sa victoire face à la Mauritanie (1-0) ce...,Afrique – Sport,https://i0.wp.com/beninwebtv.com/wp-content/uploads/2024/01/centrafrique-cap-vert.webp?resize=696%2C392&ssl=1,https://beninwebtv.com/can-2023-le-cap-vert-surclasse-la-mauritanie-et-file-en-quart-de-finale/,Cap-Vert,,beninwebtv,fr,,
"CAN 2023: avec Bebé, les compos officielles de Cap-Vert vs Mauritanie",Romaric Déguénon,https://beninwebtv.com/author/romaric/,29 janvier 2024,"Découvrez les compos officielles du match Cap-Vert vs Mauritanie ce lundi soir (18 heures, GMT+1) au stade Le Félicia, comptant pour les huitièmes de...",Afrique – Sport,https://i0.wp.com/beninwebtv.com/wp-content/uploads/2024/01/centrafrique-cap-vert.webp?resize=696%2C392&ssl=1,https://beninwebtv.com/can-2023-avec-bebe-les-compos-officielles-de-cap-vert-vs-mauritanie/,Cap-Vert,,beninwebtv,fr,,
Côte d’Ivoire : un fils tue sa mère sous l’emprise de stupéfiants,Kevin Aka,https://beninwebtv.com/author/kevin/,5 octobre 2024,"En Côte d'Ivoire, la ville de Daloa a été secouée par un événement tragique d'une violence rare. T. Sidibé, un jeune homme reconnu dans...",Faits divers,https://i0.wp.com/beninwebtv.com/wp-content/uploads/2024/10/corps-sans-vie.jpg?resize=696%2C348&ssl=1,https://beninwebtv.com/cote-divoire-un-fils-tue-sa-mere-sous-lemprise-de-stupefiants/,Côte d'Ivoire,,beninwebtv,fr,,
Côte d’Ivoire – Meurtre au campus de Cocody : avis de recherche lancé contre huit suspects,Kevin Aka,https://beninwebtv.com/author/kevin/,5 octobre 2024,"En Côte d'Ivoire, la Direction de la Police Criminelle a émis un avis de recherche concernant plusieurs individus soupçonnés d’être impliqués dans un homicide...",Société,https://i0.wp.com/beninwebtv.com/wp-content/uploads/2024/10/Citee-universitaire-Cocody.jpg?resize=696%2C463&ssl=1,https://beninwebtv.com/cote-divoire-meurtre-au-campus-de-cocody-avis-de-recherche-lance-contre-huit-suspects/,Côte d'Ivoire,,beninwebtv,fr,,
Dan Marcel gravement malade ? Vague d’inquiétudes sur la santé du chanteur,Angèle M. ADANLE,https://beninwebtv.com/author/angele/,4 octobre 2024,"L'état de santé de Dan Marcel, l'artiste chanteur et influenceur ivoirien, préoccupe ses fans et suscite une vague de spéculations sur les réseaux sociaux....",Célébrité,https://i0.wp.com/beninwebtv.com/wp-content/uploads/2024/10/Dan-Marcel-artiste-chanteur-ivoirien.jpg?resize=696%2C392&ssl=1,https://beninwebtv.com/dan-marcel-gravement-malade-vague-dinquietudes-sur-la-sante-du-chanteur/,Côte d'Ivoire,,beninwebtv,fr,,
Côte d’Ivoire : expulsion imminente des étudiants occupant illégalement les cités universitaires,Kevin Aka,https://beninwebtv.com/author/kevin/,4 octobre 2024,"En Côte d’Ivoire, le ministère de l’Enseignement supérieur a donné aux étudiants occupant illégalement les chambres des cités universitaires jusqu’au 5 octobre 2024 pour...",Société,https://i0.wp.com/beninwebtv.com/wp-content/uploads/2024/10/Citee-universitaire-Cocody.jpg?resize=696%2C463&ssl=1,https://beninwebtv.com/cote-divoire-expulsion-imminente-des-etudiants-occupant-illegalement-les-cites-universitaires/,Côte d'Ivoire,,beninwebtv,fr,,
Côte d’Ivoire – Déguerpissement du village d’Abidjan-Adjamé : Simone Gbagbo réagit,Kevin Aka,https://beninwebtv.com/author/kevin/,4 octobre 2024,"Simone Ehivet Gbagbo, présidente du Mouvement des générations capables (MGC) et ex-première dame de Côte d'Ivoire, a exprimé sa solidarité envers les habitants expulsés...",Politique,https://i0.wp.com/beninwebtv.com/wp-content/uploads/2023/08/Cote-dIvoire-Municipales-2023-Simone-Gbagbo-prend-une-surprenante-decision.jpg?resize=696%2C428&ssl=1,https://beninwebtv.com/cote-divoire-deguerpissement-du-village-dabidjan-adjame-simone-gbagbo-reagit/,Côte d'Ivoire,,beninwebtv,fr,,
Côte d’Ivoire – Révision de la liste électorale: Coulibaly-Kuibiert Ibrahime fait des précisions,Kevin Aka,https://beninwebtv.com/author/kevin/,3 octobre 2024,"Le président de la Commission Électorale Indépendante (CEI), Coulibaly-Kuibiert Ibrahime, a dévoilé ce mercredi 2 octobre 2024 à Abidjan les nouvelles dispositions relatives à...",Politique,https://i0.wp.com/beninwebtv.com/wp-content/uploads/2024/07/Ibrahime-Coulibaly-Kuibiert.jpg?resize=696%2C464&ssl=1,https://beninwebtv.com/cote-divoire-revision-de-la-liste-electorale-coulibaly-kuibiert-ibrahime-fait-des-precisions/,Côte d'Ivoire,,beninwebtv,fr,,
"Côte d’Ivoire: interdit d’utiliser le nom Gbagbo, Simone Ehivet sort du silence",Kevin Aka,https://beninwebtv.com/author/kevin/,2 octobre 2024,"Simone Ehivet, ancienne Première Dame de Côte d’Ivoire et présidente du Mouvement des Générations Capables (MGC), a finalement pris la parole au sujet de...",Politique,https://i0.wp.com/beninwebtv.com/wp-content/uploads/2022/03/R-2-2-1.jpg?resize=696%2C392&ssl=1,https://beninwebtv.com/cote-divoire-interdit-dutiliser-le-nom-gbagbo-simone-ehivet-sort-du-silence/,Côte d'Ivoire,,beninwebtv,fr,,
Côte d’Ivoire – Meurtre d’Agui Mars Aubin Déagoué: interdiction des activités des associations syndicales estudiantines,Kevin Aka,https://beninwebtv.com/author/kevin/,2 octobre 2024,"Le mardi 1er octobre 2024, le gouvernement ivoirien a annoncé l’interdiction des activités des associations syndicales estudiantines sur tout le territoire national, suite au...",Société,https://i0.wp.com/beninwebtv.com/wp-content/uploads/2024/10/FESCI.jpg?resize=696%2C348&ssl=1,https://beninwebtv.com/cote-divoire-meurtre-dagui-mars-aubin-deagoue-interdiction-des-activites-des-associations-syndicales-estudiantines/,Côte d'Ivoire,,beninwebtv,fr,,
Côte d’Ivoire – 19ᵉ sommet de la Francophonie: Alassane Ouattara attendu à Paris,Kevin Aka,https://beninwebtv.com/author/kevin/,2 octobre 2024,"Le Président Alassane Ouattara a quitté Abidjan ce mardi 1er octobre 2024, à la suite d'une réunion importante de son parti, pour se rendre...",Politique,https://i0.wp.com/beninwebtv.com/wp-content/uploads/2022/09/Le-president-Ivoirien-Alassabe-Ouattara-a-la-77e-session-de-lAssemblee-Generale-de-lONU-a-New-York-le-mercredi-21-septembre-2022.jpg?resize=696%2C464&ssl=1,https://beninwebtv.com/cote-divoire-19%e1%b5%89-sommet-de-la-francophonie-alassane-ouattara-attendu-a-paris/,Côte d'Ivoire,,beninwebtv,fr,,
Côte d’Ivoire – Mort d’Agui Mars Aubin Deagoué : le SG de la FESCI interpellé,Kevin Aka,https://beninwebtv.com/author/kevin/,2 octobre 2024,"En Côte d'Ivoire, le secrétaire général de la FESCI, Kambou Sié, ainsi que plusieurs de ses collaborateurs, ont été arrêtés par la Direction de...",Société,https://i0.wp.com/beninwebtv.com/wp-content/uploads/2024/10/Kambou-Sie.jpg?resize=696%2C348&ssl=1,https://beninwebtv.com/cote-divoire-mort-dagui-mars-aubin-deagoue-le-sg-de-la-fesci-interpelle/,Côte d'Ivoire,,beninwebtv,fr,,
Sénégal : visite du Chef d’État-Major de l’armée gambienne,Kevin Aka,https://beninwebtv.com/author/kevin/,25 septembre 2024,"Depuis le mardi 24 septembre, le Général Mamath Cham, Chef d'État-Major Général des Forces Armées Gambiennes, est au Sénégal afin de renforcer la coopération...",Diplomatie,https://i0.wp.com/beninwebtv.com/wp-content/uploads/2024/09/Le-General-Mamath-Cham-et-le-General-Mbaye-Cisse.jpg?resize=696%2C348&ssl=1,https://beninwebtv.com/senegal-visite-du-chef-detat-major-de-larmee-gambienne/,Gambie,,beninwebtv,fr,,
"CAN 2025 (Q): Comores, Gambie, Rwanda, le programme de ce mercredi",Romaric Déguénon,https://beninwebtv.com/author/romaric/,4 septembre 2024,"Plusieurs matchs sont au programme ce mercredi à travers l'Afrique, comptant pour la première journée des éliminatoires de la CAN 2025. Découvrez les affiches...",Afrique – Sport,https://i0.wp.com/beninwebtv.com/wp-content/uploads/2024/03/Rwanda.webp?resize=696%2C464&ssl=1,https://beninwebtv.com/can-2025-q-comores-gambie-rwanda-le-programme-de-ce-mercredi/,Gambie,,beninwebtv,fr,,
"Gambie : arrestation de Bora Colley, ancien général sous le régime de Yahya Jammeh",Kevin Aka,https://beninwebtv.com/author/kevin/,14 août 2024,"En Gambie, l'armée a annoncé l'arrestation de l'ex-général de brigade Bora Colley, suspecté d'être membre d'un escadron de la mort sous l'ancien président exilé...",Société,https://i0.wp.com/beninwebtv.com/wp-content/uploads/2024/08/Le-general-Bora-Colley.jpg?resize=696%2C348&ssl=1,https://beninwebtv.com/gambie-arrestation-de-bora-colley-ancien-general-sous-le-regime-de-yahya-jammeh/,Gambie,,beninwebtv,fr,,
Sénégal: Bassirou Diomaye Faye reçoit le vice-président gambien Mohammed B.S. Jallow,Kevin Aka,https://beninwebtv.com/author/kevin/,6 août 2024,"Le Président sénégalais Diomaye Faye a accueilli, le lundi 5 août 2024, le vice-président gambien, Mohammed B.S. Jallow, en visite de travail dans le...",Politique,https://i0.wp.com/beninwebtv.com/wp-content/uploads/2024/08/Bassirou-Diomaye-Faye-et-Mohammed-B.S.-Jallow.jpg?resize=696%2C464&ssl=1,https://beninwebtv.com/senegal-bassirou-diomaye-faye-recoit-le-vice-president-gambien-mohammed-b-s-jallow/,Gambie,,beninwebtv,fr,,
Gambie : les députés rejettent la réintroduction des excisions,Casimir Vodjo,https://beninwebtv.com/author/benjamin/,16 juillet 2024,Les députés gambiens ont rejeté lundi un projet de loi visant à lever l'interdiction de l'excision. Cette décision a été saluée par les militants...,Politique,https://i0.wp.com/beninwebtv.com/wp-content/uploads/2024/07/excision-1.webp?resize=696%2C464&ssl=1,https://beninwebtv.com/gambie-les-deputes-rejettent-la-reintroduction-des-excisions/,Gambie,,beninwebtv,fr,,
CDM 2026 (Q): la Gambie cartonne les Seychelles et se relance,Romaric Déguénon,https://beninwebtv.com/author/romaric/,8 juin 2024,"La Gambie a facilement disposé des Seychelles (5-1) ce samedi soir, lors de la troisième journée des éliminatoires de la Coupe du Monde 2026....",Football,https://i0.wp.com/beninwebtv.com/wp-content/uploads/2024/01/Gambie-1.webp?resize=696%2C464&ssl=1,https://beninwebtv.com/cdm-2026-q-la-gambie-cartonne-les-seychelles-et-se-relance/,Gambie,,beninwebtv,fr,,
