title,author_name,author_url,publication_date,description,category,image_url,url,country,content_preview,extractor,lang,content,source
"Guinée équatoriale : Teodoro Obiang Nguema Mbasogo, et de six !",,,27 nov. 2022,"Sans surprise, le 20 novembre, le chef de l’État équato-guinéen a été réélu pour un sixième mandat consécutif.",,"https://prod.cdn-medias.jeuneafrique.com/cdn-cgi/image/q=auto,f=auto,metadata=none,width=300,height=200,fit=cover/https://prod.cdn-medias.jeuneafrique.com/medias/2022/11/22/jad20221122-loeildeglez-obiangnguema.jpg",https://www.jeuneafrique.com/1394834/politique/guinee-equatoriale-teodoro-obiang-nguema-mbasogo-et-de-six/,Guinée équatoriale,,jeuneafrique,fr,,
Présidentielle en Guinée équatoriale : Obiang réélu pour un sixième mandat,,,27 nov. 2022,"Au terme d’un scrutin sans suspense, Teodoro Obiang Nguema Mbasogo a été réélu avec un score officiel triomphal de 94,9%.",,"https://prod.cdn-medias.jeuneafrique.com/cdn-cgi/image/q=auto,f=auto,metadata=none,width=300,height=200,fit=cover/https://prod.cdn-medias.jeuneafrique.com/medias/2022/10/20/jad20221020-ass-lhommedumois-obiangnguema.jpg",https://www.jeuneafrique.com/1396287/politique/presidentielle-en-guinee-equatoriale-obiang-reelu-pour-un-sixieme-mandat/,Guinée équatoriale,,jeuneafrique,fr,,
Guinée équatoriale : Obiang en tête d’une présidentielle sans suspense,,,22 nov. 2022,"Candidat à sa propre succession pour un sixième mandat, Teodoro Obiang Nguema Mbasogo a déjà obtenu près de la moitié des suffrages, selon les premiers résultats provisoires. Les résultats définitifs sont attendus le 26 novembre.",,"https://prod.cdn-medias.jeuneafrique.com/cdn-cgi/image/q=auto,f=auto,metadata=none,width=300,height=200,fit=cover/https://prod.cdn-medias.jeuneafrique.com/medias/2022/11/22/afpcom-20221120-partners-068-aa_20112022_948330-preview.jpg",https://www.jeuneafrique.com/1395095/politique/guinee-equatoriale-obiang-en-tete-dune-presidentielle-sans-suspense/,Guinée équatoriale,,jeuneafrique,fr,,
"Présidentielle en Guinée équatoriale : Malabo accuse Madrid, Paris et Washington d’ingérence",,,6 nov. 2022,"La Guinée équatoriale a accusé dimanche 6 novembre l’Espagne, la France et les États-Unis d’« ingérence » dans ses élections présidentielle et législatives prévues le 20 novembre.",,"https://prod.cdn-medias.jeuneafrique.com/cdn-cgi/image/q=auto,f=auto,metadata=none,width=300,height=200,fit=cover/https://prod.cdn-medias.jeuneafrique.com/medias/2022/10/20/jad20221020-ass-lhommedumois-obiangnguema.jpg",https://www.jeuneafrique.com/1390868/politique/presidentielle-en-guinee-equatoriale-malabo-accuse-madrid-paris-et-washington-dingerence/,Guinée équatoriale,,jeuneafrique,fr,,
"Guinée équatoriale : d’Obiang à Obiang, un dernier scrutin avant la succession",,,2 nov. 2022,"Ce 20 novembre, Teodoro Obiang Nguema Mbasogo est une nouvelle fois candidat à sa propre succession lors de l’élection présidentielle en Guinée équatoriale. En attendant de passer le relais à son fils, Teodorín, qui piaffe d’impatience.",,"https://prod.cdn-medias.jeuneafrique.com/cdn-cgi/image/q=auto,f=auto,metadata=none,width=300,height=200,fit=cover/https://prod.cdn-medias.jeuneafrique.com/medias/2022/10/20/jad20221020-ass-lhommedumois-obiangnguema.jpg",https://www.jeuneafrique.com/1384774/politique/guinee-equatoriale-dobiang-a-obiang-un-dernier-scrutin-avant-la-succession/,Guinée équatoriale,,jeuneafrique,fr,,
"Mines en RDC : entre le chinois Zijin et l’australien AVZ, une guerre pour plus de 130 millions de tonnes de lithium",,,7 oct. 2024,"Comptant parmi les plus grands gisements de lithium inexploités au monde, le site congolais de Manono fait l’objet d’un combat acharné.",,"https://prod.cdn-medias.jeuneafrique.com/cdn-cgi/image/q=auto,f=auto,metadata=none,width=300,height=200,fit=cover,gravity=0.5000x0.5000/https://prod.cdn-medias.jeuneafrique.com/medias/2024/10/07/jad-20241007-match-zijin-avz-materials.jpg",https://www.jeuneafrique.com/1617064/economie-entreprises/mines-en-rdc-entre-le-chinois-zijin-et-laustralien-avz-une-guerre-pour-plus-de-130-millions-de-tonnes-de-lithium/,RD Congo,,jeuneafrique,fr,,
"Sommet de l’OIF : Tshisekedi se fâche, Kagame s’impose",,,5 oct. 2024,"Le sommet de la Francophonie a été le théâtre, ce samedi 5 octobre, d’un incident diplomatique entre la France et la RDC au sujet du Rwanda.",,"https://prod.cdn-medias.jeuneafrique.com/cdn-cgi/image/q=auto,f=auto,metadata=none,width=300,height=200,fit=cover/https://prod.cdn-medias.jeuneafrique.com/medias/2024/10/05/dsc05139.jpg",https://www.jeuneafrique.com/1617325/politique/sommet-de-loif-tshisekedi-se-fache-kagame-simpose/,RD Congo,,jeuneafrique,fr,,
"En RDC, la vaccination contre le Mpox débute à Goma",,,5 oct. 2024,"Selon le ministre de la Santé congolais, les premières vaccinations contre le Mpox en RDC, épicentre de l’épidémie, commencent samedi 6 octobre à Goma, dans l’est du pays.",,"https://prod.cdn-medias.jeuneafrique.com/cdn-cgi/image/q=auto,f=auto,metadata=none,width=300,height=200,fit=cover/https://prod.cdn-medias.jeuneafrique.com/medias/2024/10/05/ja_afp__20240819__rdchealthmpoxministre.jpg",https://www.jeuneafrique.com/1617284/societe/en-rdc-la-vaccination-contre-le-mpox-debute-a-goma/,RD Congo,,jeuneafrique,fr,,
Expulser les Congolais de Mayotte : un coup de com’ ?,,,4 oct. 2024,Le nouveau ministre français de l’Intérieur a voulu faire preuve de fermeté en annonçant l’expulsion par avion de Congolais en situation irrégulière à Mayotte. Mais la procédure n’a rien d’inédit.,,"https://prod.cdn-medias.jeuneafrique.com/cdn-cgi/image/q=auto,f=auto,metadata=none,width=300,height=200,fit=cover,gravity=0.5000x0.5000/https://prod.cdn-medias.jeuneafrique.com/medias/2024/10/04/jad-20241004-ass-rdc-politique-retailleau.jpg",https://www.jeuneafrique.com/1616977/politique/expulser-les-congolais-de-mayotte-un-coup-de-com/,RD Congo,,jeuneafrique,fr,,
"En RDC, Katumbi et la mystérieuse piste d’atterrissage de Mulonde",,,4 oct. 2024,"Les 1er et 2 octobre, des militaires ont fait irruption dans une propriété de Moïse Katumbi afin d’enquêter sur la réhabilitation d’une piste qui s’y trouve. Ils estiment qu’il pourrait s’agir d’une menace pour la sécurité nationale. De son côté, l’opposant assure que ces travaux sont en lien avec ses activités caritatives.",,"https://prod.cdn-medias.jeuneafrique.com/cdn-cgi/image/q=auto,f=auto,metadata=none,width=300,height=200,fit=cover,gravity=0.5946x0.2627/https://prod.cdn-medias.jeuneafrique.com/medias/2024/10/03/jad-20241003-ass-rdc-politique-katumbi.jpg",https://www.jeuneafrique.com/1616337/politique/en-rdc-katumbi-et-la-mysterieuse-piste-de-mulonde/,RD Congo,,jeuneafrique,fr,,
Droits de l’homme en RDC : les silences du président Tshisekedi,,,4 oct. 2024,"S’exprimant devant l’Assemblée générale des Nations unies, le 25 septembre, Félix Tshisekedi n’a pas mentionné la détérioration de la situation des droits de l’homme dans son pays. Pourtant, la RDC espère intégrer le Conseil des droits humains de l’ONU, le 9 octobre. La communauté internationale doit l’inciter à changer de cap.",,"https://prod.cdn-medias.jeuneafrique.com/cdn-cgi/image/q=auto,f=auto,metadata=none,width=300,height=200,fit=cover,gravity=0.5000x0.5000/https://prod.cdn-medias.jeuneafrique.com/medias/2024/10/03/jad20241003-tribune-rdc-onu-tshisekedi-droits-humains.jpg",https://www.jeuneafrique.com/1616154/politique/droits-de-lhomme-en-rdc-les-silences-du-president-tshisekedi/,RD Congo,,jeuneafrique,fr,,
Révision de la Constitution : Félix Tshisekedi franchira-t-il le Rubicon ? ,,,3 oct. 2024,"Alors que le président de la RDC, réélu en décembre dernier, amorce son second mandat, son entourage remet sur la table la question ultrasensible d’une réforme constitutionnelle. ",,"https://prod.cdn-medias.jeuneafrique.com/cdn-cgi/image/q=auto,f=auto,metadata=none,width=300,height=200,fit=cover/https://prod.cdn-medias.jeuneafrique.com/medias/2024/10/02/jad20241002-ass-rdc-tshisekedi-constitution.jpg",https://www.jeuneafrique.com/1615979/politique/revision-de-la-constitution-felix-tshisekedi-franchira-t-il-le-rubicon/,RD Congo,,jeuneafrique,fr,,
"En Guinée équatoriale, Teodorín Obiang renforce son contrôle sur le gouvernement",,,27 août 2024,"Le président Teodoro Obiang Nguema Mbasogo a procédé, le 16 août, à un remaniement en nommant notamment un nouveau Premier ministre. Mais c’est l’influence de son fils et vice-président, Teodorín Obiang, qui en sort consolidée.",,"https://prod.cdn-medias.jeuneafrique.com/cdn-cgi/image/q=auto,f=auto,metadata=none,width=300,height=200,fit=cover,gravity=0.5000x0.5000/https://prod.cdn-medias.jeuneafrique.com/medias/2024/08/27/jda20240827-ass-guinee-equat-politique.jpg",https://www.jeuneafrique.com/1602398/politique/en-guinee-equatoriale-teodorin-obiang-renforce-son-controle-sur-le-gouvernement/,République du Congo,,jeuneafrique,fr,,
"En Guinée équatoriale, 18 ans de prison requis contre un fils Obiang",,,20 août 2024,"Ruslan Obiang Nsue a été jugé pour avoir illégalement vendu un avion de la compagnie aérienne nationale. Les autorités ont ouvert une enquête en novembre 2022 après avoir constaté la disparition de l’appareil, un ATR 72-500 appartenant à Ceiba Intercontinental, et qui se trouvait depuis 2018 en révision de routine en Espagne.",,"https://prod.cdn-medias.jeuneafrique.com/cdn-cgi/image/q=auto,f=auto,metadata=none,width=300,height=200,fit=cover/https://prod.cdn-medias.jeuneafrique.com/medias/2011/06/24/015062011174126000000ruslannsue.jpg",https://www.jeuneafrique.com/1600219/politique/en-guinee-equatoriale18-ans-de-prison-requis-contre-un-fils-obiang/,République du Congo,,jeuneafrique,fr,,
Le directeur de la Banque centrale nommé Premier ministre en Guinée équatoriale,,,18 août 2024,"Fin juillet, le gouvernement de Manuela Roka Botey avait présenté sa démission, à la demande du président de la République, 18 mois seulement après sa nomination.",,"https://prod.cdn-medias.jeuneafrique.com/cdn-cgi/image/q=auto,f=auto,metadata=none,width=300,height=200,fit=cover/https://prod.cdn-medias.jeuneafrique.com/medias/2016/06/17/image173075-e1466610479961.jpg",https://www.jeuneafrique.com/1599714/politique/le-directeur-de-la-banque-centrale-nomme-premier-ministre-en-guinee-equatoriale/,République du Congo,,jeuneafrique,fr,,
"Tchad, Guinée équatoriale… Quand pétrole et développement ne font pas bon ménage",,,11 juil. 2024,"Les deux pays ont bénéficié d’importantes découvertes de pétrole à la fin des années 1990. Mais plus de deux décennies plus tard, malgré les milliards de dollars de recettes, rien n’a changé pour l’écrasante majorité de la population.",,"https://prod.cdn-medias.jeuneafrique.com/cdn-cgi/image/q=auto,f=auto,metadata=none,width=300,height=200,fit=cover,gravity=0.5000x0.5000/https://prod.cdn-medias.jeuneafrique.com/medias/2024/07/09/jad20240709-serie-eco-petrole-gaz-tchad-doba-episode-2.jpg",https://www.jeuneafrique.com/1584618/economie-entreprises/tchad-guinee-equatoriale-quand-le-petrole-et-le-developpement-ne-font-pas-bon-menage/,République du Congo,,jeuneafrique,fr,,
"En Guinée équatoriale, l’ancien ministre de la Justice grâcié et libéré",,,9 juil. 2024,"Ruben Maye Nsue Mangue était détenu depuis 2022 pour avoir critiqué le président Obiang. Il n’a jamais été assisté d’un avocat, ni n’a été jugé.",,"https://prod.cdn-medias.jeuneafrique.com/cdn-cgi/image/q=auto,f=auto,metadata=none,width=300,height=200,fit=cover/https://prod.cdn-medias.jeuneafrique.com/medias/2023/06/23/jad20230623-conf-sommet-paris-obiang.jpg",https://www.jeuneafrique.com/1586154/politique/en-guinee-equatoriale-lancien-ministre-de-la-justice-gracie-et-libere/,République du Congo,,jeuneafrique,fr,,
Le calvaire de deux Sud-Africains emprisonnés depuis 500 jours en Guinée équatoriale,,,25 juin 2024,Les familles de Frederik Potgieter et Peter Huxham tentent d’obtenir le soutien du Parlement panafricain pour obtenir la libération de ces deux ingénieurs arrêtés le 9 février 2023.,,"https://prod.cdn-medias.jeuneafrique.com/cdn-cgi/image/q=auto,f=auto,metadata=none,width=300,height=200,fit=cover,gravity=0.5000x0.5000/https://prod.cdn-medias.jeuneafrique.com/medias/2024/06/25/jad-ass-guinee-equatoriale-afrique-du-sud-prisonniers.jpg",https://www.jeuneafrique.com/1581193/politique/le-calvaire-de-deux-sud-africains-emprisonnes-depuis-500-jours-en-guinee-equatoriale/,République du Congo,,jeuneafrique,fr,,
"Chantage, sextape et menaces : entre les Obiang et Juan Carlos Ondo Angue, la guerre est déclarée",,,8 avr. 2024,"L’ancien président de la Cour suprême de Guinée équatoriale, aujourd’hui exilé, tente de rassembler l’opposition derrière lui contre le chef de l’État et son fils, Teodorín. Il a l’oreille de la communauté internationale mais la stratégie n’est pas sans risque.",,"https://prod.cdn-medias.jeuneafrique.com/cdn-cgi/image/q=auto,f=auto,metadata=none,width=300,height=200,fit=cover/https://prod.cdn-medias.jeuneafrique.com/medias/2024/04/04/jad20240404-le-match-obiang-ondo-angue.jpg",https://www.jeuneafrique.com/1554619/politique/chantage-sextape-et-menaces-entre-les-obiang-et-juan-carlos-ondo-angue-la-guerre-est-declaree/,République du Congo,,jeuneafrique,fr,,
"Juan Micha, sélectionneur : « La Guinée équatoriale peut battre les meilleurs »",,,28 janv. 2024,"Épatante lors du premier tour, où elle a terminé en tête du groupe A, la Guinée équatoriale va affronter la Guinée dimanche 28 janvier à Abidjan, en huitièmes de finale de la CAN. Juan Micha, le sélectionneur du Nzalang Nacional, rappelle que les résultats de son équipe sont tout sauf une surprise.",,"https://prod.cdn-medias.jeuneafrique.com/cdn-cgi/image/q=auto,f=auto,metadata=none,width=300,height=200,fit=cover,gravity=0.4747x0.3493/https://prod.cdn-medias.jeuneafrique.com/medias/2024/01/26/jad20240126-can-2024-guinee-equatoriale-itv-juanmicha.jpg",https://www.jeuneafrique.com/1530475/societe/juan-micha-selectionneur-la-guinee-equatoriale-peut-battre-les-meilleurs/,République du Congo,,jeuneafrique,fr,,
CAN en Côte d’Ivoire : les Obiang promettent le jackpot,,,23 janv. 2024,"Le président équato-guinéen, Teodoro Obiang Nguema Mbasogo, et son fils, le vice-président Teodoro Nguema Obiang Mangue, suivent de près la Coupe d’Afrique des nations. Alors que la sélection de leur pays a surpris en surclassant la Côte d’Ivoire, ils ont promis des primes mirobolantes aux joueurs.",,"https://prod.cdn-medias.jeuneafrique.com/cdn-cgi/image/q=auto,f=auto,metadata=none,width=300,height=200,fit=cover/https://prod.cdn-medias.jeuneafrique.com/medias/2024/01/23/jad20240123-can2024-jackpot-guinee-equatoriale.jpg",https://www.jeuneafrique.com/1528930/societe/can-en-cote-divoire-les-obiang-promettent-le-jackpot/,République du Congo,,jeuneafrique,fr,,
Vers un sommet Afrique-Russie en Guinée équatoriale ?,,,11 janv. 2024,Moscou et Malabo sont en discussion depuis plusieurs semaines pour organiser la prochaine édition du sommet Afrique-Russie. Coulisses.,,"https://prod.cdn-medias.jeuneafrique.com/cdn-cgi/image/q=auto,f=auto,metadata=none,width=300,height=200,fit=cover,gravity=0.3986x0.2846/https://prod.cdn-medias.jeuneafrique.com/medias/2024/01/10/jad20240110-conf-guinee-equatoriale-sommet-russie-afrique.jpg",https://www.jeuneafrique.com/1524008/politique/vers-un-sommet-afrique-russie-en-guinee-equatoriale/,République du Congo,,jeuneafrique,fr,,
CAN – Groupe A : les Éléphants attendus au tournant,,,8 janv. 2024,La Côte d’Ivoire et le Nigeria sont les favoris de ce groupe. Mais ils feront face à deux équipes réputées difficiles à manœuvrer : la Guinée-Bissau et la Guinée équatoriale.,,"https://prod.cdn-medias.jeuneafrique.com/cdn-cgi/image/q=auto,f=auto,metadata=none,width=300,height=200,fit=cover,gravity=0.5000x0.5000/https://prod.cdn-medias.jeuneafrique.com/medias/2024/01/08/jad20240108-pol-can-groupe-a-scaled.jpg",https://www.jeuneafrique.com/1516854/societe/can-groupe-a-les-elephants-attendus-au-tournant/,République du Congo,,jeuneafrique,fr,,
La France peut-elle rendre à Malabo de l’argent détourné par Malabo ?,,,25 nov. 2023,"Le budget de l’État français prévoit pour la première fois la restitution de 6,1 millions d’euros à la Guinée équatoriale dans le cadre de l’affaire dite des biens mal acquis, pour laquelle Teodoro Nguema Obiang Mangue, dit Teodorín, actuel vice-président du pays, a été condamné.",,"https://prod.cdn-medias.jeuneafrique.com/cdn-cgi/image/q=auto,f=auto,metadata=none,width=300,height=200,fit=cover/https://prod.cdn-medias.jeuneafrique.com/medias/2023/11/20/ja20231120-oeildeglez-biens-mal-acquis-bonne-versionjpg.jpg",https://www.jeuneafrique.com/1505881/politique/la-france-peut-elle-rendre-a-malabo-de-largent-detourne-par-malabo/,République du Congo,,jeuneafrique,fr,,
"En Guinée équatoriale, le mystérieux assassinat d’« Abuelo Lima », beau-frère du président Obiang",,,8 nov. 2023,"Parent de Teodoro Obiang Nguema Mbasogo, José Lima Gonzalo a été retrouvé mort à son domicile de Malabo, le 21 octobre. L’enquête s’oriente vers une histoire de jalousie et de vengeance. Mais le profil de la victime politise l’affaire.",,"https://prod.cdn-medias.jeuneafrique.com/cdn-cgi/image/q=auto,f=auto,metadata=none,width=300,height=200,fit=cover,gravity=0.4530x0.2663/https://prod.cdn-medias.jeuneafrique.com/medias/2023/11/08/jad20231108-ass-guinee-jose-lima-gonzalo-01.jpg",https://www.jeuneafrique.com/1502065/politique/en-guinee-equatoriale-le-mysterieux-assassinat-dabuelo-lima-beau-frere-du-president-obiang/,République du Congo,,jeuneafrique,fr,,
Les dessous de la courte visite de Brice Clotaire Oligui Nguema à Malabo,,,21 sept. 2023,"Le nouveau président de la transition a quitté le Gabon le temps d’une journée pour s’entretenir avec son homologue équato-guinéen, Teodoro Obiang Nguema Mbasogo.",,"https://prod.cdn-medias.jeuneafrique.com/cdn-cgi/image/q=auto,f=auto,metadata=none,width=300,height=200,fit=cover/https://prod.cdn-medias.jeuneafrique.com/medias/2023/09/21/jad20230921-conf-guinee-equ-visite-oligui-nguema-01.jpg",https://www.jeuneafrique.com/1484716/politique/les-dessous-de-la-courte-visite-de-brice-oligui-nguema-a-malabo/,République du Congo,,jeuneafrique,fr,,
"Teodorín, Gabriel, Ruslan… Guerre des clans chez les Obiang",,,10 juil. 2023,"Depuis de nombreuses années, la succession de Teodoro Obiang Nguema Mbasogo se prépare en Guinée équatoriale. Et, sur ce point, la famille du président est loin d’être unie. Deux camps s’opposent, chacun espérant favoriser un fils du chef de l’État ou un autre.",,"https://prod.cdn-medias.jeuneafrique.com/cdn-cgi/image/q=auto,f=auto,metadata=none,width=300,height=200,fit=cover/https://prod.cdn-medias.jeuneafrique.com/medias/2023/07/07/jad20230707-serie-fratrie-1-obiang.jpg",https://www.jeuneafrique.com/1458477/politique/teodorin-gabriel-ruslan-guerre-des-clans-chez-les-obiang/,République du Congo,,jeuneafrique,fr,,
"[Série] Bongo, Déby, Gnassingbé, Obiang… Des fratries à l’épreuve du pouvoir",,,10 juil. 2023,"Ils sont frères, ou frère et sœur, et la politique les a poussés à s’affronter. Après le décès d’un père pour les Bongo, les Déby Itno ou les Gnassingbé, ou dans la perspective de sa succession chez les Obiang… Du Tchad au Gabon, voyage au cœur des familles parmi les plus puissantes du continent.",,"https://prod.cdn-medias.jeuneafrique.com/cdn-cgi/image/q=auto,f=auto,metadata=none,width=300,height=200,fit=cover/https://prod.cdn-medias.jeuneafrique.com/medias/2023/07/07/jad20230707-serie-fratrie-intro.jpg",https://www.jeuneafrique.com/1461016/politique/serie-bongo-deby-gnassingbe-obiang-des-fratries-a-lepreuve-du-pouvoir/,République du Congo,,jeuneafrique,fr,,
"En Guinée équatoriale, 29 ans de prison pour le principal opposant à Obiang Nguema",,,27 juin 2023,"Gabriel Nse Obiang Obono a été condamné lundi par un tribunal militaire de Malabo pour « homicide, exercice abusif des droits fondamentaux, insultes aux forces de sécurité, possession illégale de munitions ».",,"https://prod.cdn-medias.jeuneafrique.com/cdn-cgi/image/q=auto,f=auto,metadata=none,width=300,height=200,fit=cover/https://prod.cdn-medias.jeuneafrique.com/medias/2023/06/27/33ad9d9-preview.jpg",https://www.jeuneafrique.com/1457996/politique/en-guinee-equatoriale-29-ans-de-prison-pour-le-principal-opposant-a-obiang-nguema/,République du Congo,,jeuneafrique,fr,,
Sommet de l’Élysée : Obiang persona non grata ?,,,23 juin 2023,"Le président équato-guinéen Teodoro Obiang Nguema Mbasogo n’est pas à Paris, où se sont retrouvés beaucoup de ses homologues. Et pour cause : il n’a pas été invité.",,"https://prod.cdn-medias.jeuneafrique.com/cdn-cgi/image/q=auto,f=auto,metadata=none,width=300,height=200,fit=cover/https://prod.cdn-medias.jeuneafrique.com/medias/2023/06/23/jad20230623-conf-sommet-paris-obiang.jpg",https://www.jeuneafrique.com/1456762/politique/sommet-de-lelysee-obiang-persona-non-grata/,République du Congo,,jeuneafrique,fr,,
"Obiang, l’Unesco et la France : les millions de la discorde",,,10 mars 2023,"Le président équato-guinéen, Teodoro Obiang Nguema Mbasogo, remet ce 10 mars à Malabo le prix de l’Unesco pour la recherche en sciences de la vie. Une cérémonie dont les coulisses politiques n’ont rien d’anodines…",,"https://prod.cdn-medias.jeuneafrique.com/cdn-cgi/image/q=auto,f=auto,metadata=none,width=300,height=200,fit=cover/https://prod.cdn-medias.jeuneafrique.com/medias/2023/03/10/jad20230310-conf-unesco-france-obiang.jpg",https://www.jeuneafrique.com/1426023/politique/obiang-lunesco-et-la-france-les-millions-de-la-discorde/,République du Congo,,jeuneafrique,fr,,
"Au One Forest Summit, les pays du bassin du Congo affichent leur unité face au Nord",,,3 mars 2023,"Le sommet sur l’environnement coorganisé par Emmanuel Macron et Ali Bongo Ondimba s’est clos ce jeudi 2 mars à Libreville. L’enjeu pour la région est de valoriser ses ressources, alors que le bassin du Congo est le principal poumon de la planète.",,"https://prod.cdn-medias.jeuneafrique.com/cdn-cgi/image/q=auto,f=auto,metadata=none,width=300,height=200,fit=cover/https://prod.cdn-medias.jeuneafrique.com/medias/2023/03/03/bassin-congo-sommet.jpg",https://www.jeuneafrique.com/1423109/societe/au-one-forest-summit-les-pays-du-bassin-du-congo-affichent-leur-unite-face-au-nord/,République du Congo,,jeuneafrique,fr,,
"En Guinée équatoriale, Manuela Roka Botey nommée Première ministre",,,1 févr. 2023,"Pour la première fois à Malabo, c’est à une femme que le président Teodoro Obiang Nguema Mbasogo a confié les rênes du gouvernement.",,"https://prod.cdn-medias.jeuneafrique.com/cdn-cgi/image/q=auto,f=auto,metadata=none,width=300,height=200,fit=cover/https://prod.cdn-medias.jeuneafrique.com/medias/2023/02/01/jad20230201-ass-guinee-roka-botey-01.jpg",https://www.jeuneafrique.com/1414007/politique/en-guinee-equatoriale-manuela-roka-botey-nommee-premiere-ministre/,République du Congo,,jeuneafrique,fr,,
Les « biens mal acquis » de Teodorín Obiang vendus (très chers) aux enchères à Paris,,,28 janv. 2023,"Le 20 janvier à Paris s’est tenue la vente aux enchères des biens mobiliers saisis par la justice de Teodorín Obiang, vice-président de la Guinée équatoriale. Un cas d’école dans la restitution aux populations des avoirs confisqués.",,"https://prod.cdn-medias.jeuneafrique.com/cdn-cgi/image/q=auto,f=auto,metadata=none,width=300,height=200,fit=cover/https://prod.cdn-medias.jeuneafrique.com/medias/2023/01/27/jad20230127-ass-guinee-equatoriale-teodorin-obiang-1.jpg",https://www.jeuneafrique.com/1412927/politique/les-biens-mal-acquis-de-teodorin-obiang-vendus-tres-chers-aux-encheres-a-paris/,République du Congo,,jeuneafrique,fr,,
"Chez les Obiang, entre Teodorín et Ruslan, une guerre de succession avant l’heure ?",,,20 janv. 2023,"L’arrestation de Ruslan Obiang Nsue a défrayé la chronique. Si ce fils du président est accusé d’avoir vendu un avion de la compagnie aérienne nationale à des fins d’enrichissement personnel, il paie surtout le fait d’être un potentiel prétendant à la succession de Teodoro Obiang Nguema Mbasogo.",,"https://prod.cdn-medias.jeuneafrique.com/cdn-cgi/image/q=auto,f=auto,metadata=none,width=300,height=200,fit=cover/https://prod.cdn-medias.jeuneafrique.com/medias/2023/01/20/jap20230120-pol-ruslan-et-teodorin.jpg",https://www.jeuneafrique.com/1410779/politique/chez-les-obiang-entre-teodorin-et-ruslan-une-guerre-de-succession-avant-lheure/,République du Congo,,jeuneafrique,fr,,
"En Guinée équatoriale, l’un des fils du président Obiang arrêté pour corruption présumée",,,17 janv. 2023,"Ruslan Obiang Nsue, fils du président de Guinée équatoriale, est soupçonné d’avoir vendu un avion de la compagnie aérienne nationale. Il a été arrêté sur ordre de son demi-frère, Teodorín, et placé en résidence surveillée.",,"https://prod.cdn-medias.jeuneafrique.com/cdn-cgi/image/q=auto,f=auto,metadata=none,width=300,height=200,fit=cover/https://prod.cdn-medias.jeuneafrique.com/medias/2023/01/17/jad20230117-ass-obiang-avion-ceiba.jpg",https://www.jeuneafrique.com/1409545/politique/en-guinee-equatoriale-lun-fils-du-president-obiang-arrete-pour-corruption-presumee/,République du Congo,,jeuneafrique,fr,,
