title,author_name,author_url,publication_date,description,category,image_url,url,country,content_preview,extractor,lang,content,source
Départ sous tension des Scorpions gambiens pour la CAN,,,11 janv. 2024,"Avant de s’envoler pour disputer la CAN, les footballeurs de l’équipe nationale de Gambie ont boycotté leur dernier entraînement pour réclamer une prime de qualification. Qu’ils ont obtenue.",,"https://prod.cdn-medias.jeuneafrique.com/cdn-cgi/image/q=auto,f=auto,metadata=none,width=300,height=200,fit=cover,gravity=0.2875x0.4203/https://prod.cdn-medias.jeuneafrique.com/medias/2024/01/11/9xf4lu-highres.jpg",https://www.jeuneafrique.com/1524138/societe/depart-pour-la-can-sous-tension-des-scorpions-gambiens/,Ghana,,jeuneafrique,fr,,
Procès d’Ousman Sonko : historique pour la Gambie et la compétence universelle,,,9 janv. 2024,"Ce 8 janvier s’est ouvert, en Suisse, le procès d’Ousman Sonko, un haut cadre du régime de Yahya Jammeh, en Gambie. Un événement à plus d’un titre.",,"https://prod.cdn-medias.jeuneafrique.com/cdn-cgi/image/q=auto,f=auto,metadata=none,width=300,height=200,fit=cover,gravity=0.5038x0.3889/https://prod.cdn-medias.jeuneafrique.com/medias/2024/01/09/proces_suisse_sonko_ousman_gambie_lr.jpg",https://www.jeuneafrique.com/1522865/societe/proces-dousman-sonko-historique-pour-la-gambie-et-la-competence-universelle/,Ghana,,jeuneafrique,fr,,
"En Gambie, des sirops et des tests frelatés ?",,,26 déc. 2023,"Plus d’un an après le décès, en Gambie, de 69 enfants ayant absorbé des sirops contre la toux, un enquêteur évoque l’éventuelle corruption d’un régulateur indien des médicaments.",,"https://prod.cdn-medias.jeuneafrique.com/cdn-cgi/image/q=auto,f=auto,metadata=none,width=300,height=200,fit=cover,gravity=0.5000x0.5000/https://prod.cdn-medias.jeuneafrique.com/medias/2023/12/26/jad20231226-ass-gambie-sirops-frelates-glez.jpg",https://www.jeuneafrique.com/1519595/societe/en-gambie-des-sirops-et-des-tests-frelates/,Ghana,,jeuneafrique,fr,,
"En Gambie, Adama Barrow suspend les déplacements à l’étranger du gouvernement",,,20 août 2023,Le président gambien a suspendu jusqu’à la fin de l’année les déplacements à l’étranger pour lui et tous les ministères afin de réduire les dépenses publiques.,,"https://prod.cdn-medias.jeuneafrique.com/cdn-cgi/image/q=auto,f=auto,metadata=none,width=300,height=200,fit=cover/https://prod.cdn-medias.jeuneafrique.com/medias/2022/04/10/1ih66p-highres.jpg",https://www.jeuneafrique.com/1474494/politique/en-gambie-adama-barrow-suspend-les-deplacements-a-letranger-du-gouvernement/,Ghana,,jeuneafrique,fr,,
"De l’antigel dans les sirops : en Gambie, la cause de la mort de dizaines d’enfants confirmée",,,23 juil. 2023,"Quatre types de sirops importés d’Inde sont responsables de la mort d’au moins 70 enfants des suites d’insuffisance rénale aiguë en 2022, a indiqué une commission d’enquête de la présidence gambienne.",,"https://prod.cdn-medias.jeuneafrique.com/cdn-cgi/image/q=auto,f=auto,metadata=none,width=300,height=200,fit=cover/https://prod.cdn-medias.jeuneafrique.com/medias/2023/07/23/32l729r-highres.jpg",https://www.jeuneafrique.com/1466069/societe/de-lantigel-dans-les-sirops-en-gambie-la-cause-de-la-mort-de-dizaines-denfants-confirmee/,Ghana,,jeuneafrique,fr,,
"En Gambie, Yahya Jammeh bientôt dans le box des accusés ?",,,30 juin 2023,Le président Adama Barrow s’est engagé à mettre en place le bureau du procureur spécial qui jugera les crimes commis sous le régime de son prédécesseur.,,"https://prod.cdn-medias.jeuneafrique.com/cdn-cgi/image/q=auto,f=auto,metadata=none,width=300,height=200,fit=cover/https://prod.cdn-medias.jeuneafrique.com/medias/2023/06/30/jad20230630-conf-gambie-jammeh.jpg",https://www.jeuneafrique.com/1455870/politique/en-gambie-yahya-jammeh-bientot-dans-le-box-des-accuses/,Ghana,,jeuneafrique,fr,,
La Gambie veut faire la lumière sur le coup d’État déjoué contre Adama Barrow,,,28 déc. 2022,Une commission d’enquête doit rendre son rapport dans un mois après la tentative de putsch contrecarrée le 21 décembre visant le chef de l’État.,,"https://prod.cdn-medias.jeuneafrique.com/cdn-cgi/image/q=auto,f=auto,metadata=none,width=300,height=200,fit=cover/https://prod.cdn-medias.jeuneafrique.com/medias/2022/12/28/32j89k6-preview.jpg",https://www.jeuneafrique.com/1404431/politique/la-gambie-veut-faire-la-lumiere-sur-le-coup-detat-dejoue-contre-adama-barrow/,Ghana,,jeuneafrique,fr,,
Gambie : Adama Barrow visé par une tentative de coup d’État,,,22 déc. 2022,"Le gouvernement gambien a déclaré, ce mercredi, que le haut commandement de l’armée avait contrecarré un coup de force militaire la veille. Quatre soldats ont été arrêtés, selon le même communiqué, qui précise que la situation est « totalement sous contrôle ».",,"https://prod.cdn-medias.jeuneafrique.com/cdn-cgi/image/q=auto,f=auto,metadata=none,width=300,height=200,fit=cover/https://prod.cdn-medias.jeuneafrique.com/medias/2022/12/21/328v4b8-preview.jpg",https://www.jeuneafrique.com/1403111/politique/gambie-adama-barrow-vise-par-une-tentative-de-coup-detat/,Ghana,,jeuneafrique,fr,,
"Gambie : après la mort de 69 enfants, Adama Barrow critiqué pour son manque d’empathie",,,13 oct. 2022,"Des sirops frelatés sont soupçonnés d’avoir provoqué la mort de 69 enfants. Face à l’émoi, l’administration gambienne est accusée d’avoir manqué à son devoir de contrôle. Le Sénégal, lui, appelle les professionnels de santé à la vigilance.",,"https://prod.cdn-medias.jeuneafrique.com/cdn-cgi/image/q=auto,f=auto,metadata=none,width=300,height=200,fit=cover/https://prod.cdn-medias.jeuneafrique.com/medias/2022/10/12/32l729q-highres.jpg",https://www.jeuneafrique.com/1384471/politique/gambie-apres-la-mort-de-69-enfants-adama-barrow-critique-pour-son-manque-dempathie/,Ghana,,jeuneafrique,fr,,
Gambie : la pression s’accentue sur Adama Barrow pour que Yahya Jammeh soit jugé,,,12 sept. 2022,"Le président gambien s’est engagé à juger les responsables des crimes commis sous la dictature de son prédécesseur, dont l’ancien autocrate lui-même. Ce dernier sera-t-il extradé ? Voici les détails du dispositif mis en place.",,"https://prod.cdn-medias.jeuneafrique.com/cdn-cgi/image/q=auto,f=auto,metadata=none,width=300,height=200,fit=cover/https://prod.cdn-medias.jeuneafrique.com/medias/2022/09/09/jad20220909-conf-gambie-barrow-jammeh.jpg",https://www.jeuneafrique.com/1374866/politique/gambie-la-pression-saccentue-sur-adama-barrow-pour-que-yahya-jammeh-soit-juge/,Ghana,,jeuneafrique,fr,,
La Gambie parviendra-t-elle à stopper le trafic de bois de rose de Casamance ?,,,6 juil. 2022,"Banjul vient d’interdire toute exportation de bois pour assécher le commerce illicite de bois de rose, venu notamment de Casamance. Souvent échaudée, la société civile accueille la nouvelle avec prudence.",,"https://prod.cdn-medias.jeuneafrique.com/cdn-cgi/image/q=auto,f=auto,metadata=none,width=300,height=200,fit=cover/https://prod.cdn-medias.jeuneafrique.com/medias/2022/07/06/gambie_trafic_bois_1256.jpg",https://www.jeuneafrique.com/1359569/politique/la-gambie-parviendra-t-elle-a-stopper-le-trafic-de-bois-de-rose-de-casamance/,Ghana,,jeuneafrique,fr,,
"Cedeao : dix choses à savoir sur Omar Alieu Touray, le successeur de Jean-Claude Brou à la tête de la Commission",,,6 juil. 2022,L’ex-ministre gambien des Affaires étrangères prendra ses fonctions de président de la Commission de la Cedeao le 11 juillet. Il commence son mandat dans un contexte difficile.,,"https://prod.cdn-medias.jeuneafrique.com/cdn-cgi/image/q=auto,f=auto,metadata=none,width=300,height=200,fit=cover/https://prod.cdn-medias.jeuneafrique.com/medias/2022/07/06/jad20220706-ass-cdeao-omartouray.jpg",https://www.jeuneafrique.com/1359257/economie-entreprises/cedeao-dix-choses-a-savoir-sur-omar-alieu-touray-le-successeur-de-jean-claude-brou-a-la-cedeao/,Ghana,,jeuneafrique,fr,,
Gambie : vers le jugement dernier de Yahya Jammeh ?,,,16 juin 2022,"Les autorités de Banjul viennent de suspendre les militaires, policiers et membres des services de renseignement soupçonnés de crimes sous l’ancien régime. Un premier pas vers un procès du dictateur, espèrent ses victimes.",,"https://prod.cdn-medias.jeuneafrique.com/cdn-cgi/image/q=auto,f=auto,metadata=none,width=300,height=200,fit=cover/https://prod.cdn-medias.jeuneafrique.com/medias/2022/06/16/gambie_jammeh_fonctionnaires_suspendus_1256.jpg",https://www.jeuneafrique.com/1354812/politique/gambie-vers-le-jugement-dernier-de-yahya-jammeh/,Ghana,,jeuneafrique,fr,,
La Gambie « prête » à juger Yahya Jammeh,,,25 mai 2022,"Le gouvernement gambien s’est dit disposé à faire juger l’ancien dirigeant, accusé d’une multitude de crimes pendant ses plus de vingt années de règne. Mais la perspective d’un procès semble lointaine.",,"https://prod.cdn-medias.jeuneafrique.com/cdn-cgi/image/q=auto,f=auto,metadata=none,width=300,height=200,fit=cover/https://prod.cdn-medias.jeuneafrique.com/medias/2021/06/01/jad20210601-ass-gambie-yahya-jammeh-1.jpg",https://www.jeuneafrique.com/1349694/politique/la-gambie-prete-a-juger-yahya-jammeh/,Ghana,,jeuneafrique,fr,,
"En Guinée, qui s’oppose vraiment à Mamadi Doumbouya ?",,,7 oct. 2024,"Leaders politiques en exil, militants disparus, médias muselés, appels à manifester restés inaudibles… Le chef de la junte semble gouverner sans contre-pouvoir.",,"https://prod.cdn-medias.jeuneafrique.com/cdn-cgi/image/q=auto,f=auto,metadata=none,width=300,height=200,fit=cover/https://prod.cdn-medias.jeuneafrique.com/medias/2024/09/19/jad20240919-gfguinee-opposition-2.jpg",https://www.jeuneafrique.com/1604563/politique/en-guinee-qui-soppose-vraiment-a-mamadi-doumbouya/,Guinée,,jeuneafrique,fr,,
"« La fermeture d’un seul média est un coup dur pour la Guinée », selon le journaliste Sékou Jamal Pendessa",,,6 oct. 2024,Le leader du Syndicat des professionnels de la presse revient sur la dégradation de la situation des médias en Guinée et sur les tentatives de négociation menées avec l’exécutif pour assurer le pluralisme.,,"https://prod.cdn-medias.jeuneafrique.com/cdn-cgi/image/q=auto,f=auto,metadata=none,width=300,height=200,fit=cover/https://prod.cdn-medias.jeuneafrique.com/medias/2024/08/30/jad20240830-gfguinee-itw-jamal-pendessa.jpg",https://www.jeuneafrique.com/1602468/politique/la-fermeture-dun-seul-media-est-un-coup-dur-pour-la-guinee-selon-le-journaliste-sekou-jamal-pendessa/,Guinée,,jeuneafrique,fr,,
MTN pourra-t-il concurrencer Orange sur son terrain de jeu guinéen ?,,,4 oct. 2024,"Avec une position clairement dominante sur le marché local de la téléphonie mobile et des concurrents en difficulté, la filiale du groupe français, contrôlée par Sonatel, semble indétrônable. Mais le gouvernement n’a pas dit son dernier mot.",,"https://prod.cdn-medias.jeuneafrique.com/cdn-cgi/image/q=auto,f=auto,metadata=none,width=300,height=200,fit=cover/https://prod.cdn-medias.jeuneafrique.com/medias/2024/09/18/jad20240916-gfguinee-eco-telecom.jpg",https://www.jeuneafrique.com/1605131/economie-entreprises/mtn-pourra-t-il-concurrencer-orange-sur-son-terrain-de-jeu-guineen/,Guinée,,jeuneafrique,fr,,
"Guinée : pour Mamadi Doumbouya, le compte à rebours avant le bras de fer­ ?",,,3 oct. 2024,"En attendant le référendum constitutionnel, préalable indispensable à la tenue d’une présidentielle en 2025, la pression monte à Conakry, et le pouvoir du président de la transition se raidit.",,"https://prod.cdn-medias.jeuneafrique.com/cdn-cgi/image/q=auto,f=auto,metadata=none,width=300,height=200,fit=cover/https://prod.cdn-medias.jeuneafrique.com/medias/2024/09/19/jad20240919-gfguinee-ouverture-1.jpg",https://www.jeuneafrique.com/1602812/politique/guinee-pour-mamadi-doumbouya-le-compte-a-rebours-avant-le-bras-de-fer/,Guinée,,jeuneafrique,fr,,
Pourquoi la Guinée ne parvient toujours pas à s’électrifier,,,1 oct. 2024,"Malgré un fort potentiel hydroélectrique et d’importantes infrastructures, les délestages sont récurrents sur l’ensemble du territoire, y compris à Conakry, entre les accidents, les incidents techniques et les complexes qui tournent à bas régime. Une situation alarmante qui freine l’économie, alimente la grogne sociale, et explique que Mamadi Doumbouya ait fait du dossier de l’énergie sa priorité.",,"https://prod.cdn-medias.jeuneafrique.com/cdn-cgi/image/q=auto,f=auto,metadata=none,width=300,height=200,fit=cover/https://prod.cdn-medias.jeuneafrique.com/medias/2024/09/16/jad20240916-gfguinee-eco-electricite.jpg",https://www.jeuneafrique.com/1606322/economie-entreprises/pourquoi-la-guinee-ne-parvient-toujours-pas-a-selectrifier/,Guinée,,jeuneafrique,fr,,
Massacre du 28-Septembre en Guinée : les leçons d’un procès hors normes,,,28 sept. 2024,"Après deux ans de débats, la justice guinéenne a rendu son verdict, ce 31 juillet, dans le dossier du massacre du 28 septembre 2009 au stade de Conakry. Jeune Afrique analyse les enseignements et la portée de ce procès qualifié d’historique, ainsi que les interrogations qu’il continue de susciter.",,"https://prod.cdn-medias.jeuneafrique.com/cdn-cgi/image/q=auto,f=auto,metadata=none,width=300,height=200,fit=cover,gravity=0.5000x0.5000/https://prod.cdn-medias.jeuneafrique.com/medias/2024/09/19/jad20240919-gfguinee-dossier-sensible-proces-historique.jpg",https://www.jeuneafrique.com/1604574/politique/massacre-du-28-septembre-en-guinee-les-lecons-dun-proces-hors-normes/,Guinée,,jeuneafrique,fr,,
"Dansa Kourouma : Mamadi Doumbouya, Alpha Condé, Cellou Dalein Diallo, Claude Pivi… Les vérités du président du CNT",,,25 sept. 2024,"Le président du Conseil national de transition (CNT) de Guinée, engagé dans une campagne pour défendre le projet de nouvelle Constitution, se fait aussi l’avocat du bilan de Mamadi Doumbouya. Entretien en vidéo.",,"https://prod.cdn-medias.jeuneafrique.com/cdn-cgi/image/q=auto,f=auto,metadata=none,width=300,height=200,fit=cover,gravity=0.8820x0.1776/https://prod.cdn-medias.jeuneafrique.com/medias/2024/09/25/kopurouma.png",https://www.jeuneafrique.com/1613692/politique/dansa-kourouma-mamadi-doumbouya-alpha-conde-cellou-dalein-diallo-claude-pivi-les-verites-du-president-du-cnt/,Guinée,,jeuneafrique,fr,,
Pourquoi l’OIF a levé la suspension de la Guinée,,,25 sept. 2024,"À l’issue d’un intense lobbying mené par Conakry, l’Organisation internationale de la francophonie a annoncé la réintégration de la Guinée, trois ans après sa suspension liée au coup d’État de Mamadi Doumbouya.",,"https://prod.cdn-medias.jeuneafrique.com/cdn-cgi/image/q=auto,f=auto,metadata=none,width=300,height=200,fit=cover,gravity=0.5000x0.5000/https://prod.cdn-medias.jeuneafrique.com/medias/2024/09/25/jad20240925-ass-guinee-oif-doumbouya-mushikiwabo.jpg",https://www.jeuneafrique.com/1613273/politique/pourquoi-loif-a-leve-la-suspension-de-la-guinee/,Guinée,,jeuneafrique,fr,,
"En Guinée, l’opération transparence de Mamadi Doumbouya est-elle… transparente ?",,,22 sept. 2024,"Le chef de la junte guinéenne avait promis une gouvernance vertueuse. Trois ans plus tard, seuls d’anciens dignitaires sont derrière les barreaux. En revanche, les dossiers de plusieurs ministres et haut commis de l’État nommés depuis le début la transition et qui ont fait l’objet d’enquêtes pour corruption ont été classés sans suite.",,"https://prod.cdn-medias.jeuneafrique.com/cdn-cgi/image/q=auto,f=auto,metadata=none,width=300,height=200,fit=cover/https://prod.cdn-medias.jeuneafrique.com/medias/2024/09/19/jad20240919-gfguinee-operation-transparence.jpg",https://www.jeuneafrique.com/1605082/politique/en-guinee-loperation-transparence-de-mamadi-doumbouya-est-elle-transparente/,Guinée,,jeuneafrique,fr,,
Guinée : vers une transition à durée indéterminée ?,,,21 sept. 2024,"Réforme constitutionnelle, organisation des élections, éventuelle candidature de Mamadi Doumbouya à la présidentielle… François Soudan revient, au micro de RFI, sur les défis auxquels la Guinée est confrontée, trois ans après le coup d’État. Un dossier à retrouver dans le numéro de Jeune Afrique d’octobre.",,"https://prod.cdn-medias.jeuneafrique.com/cdn-cgi/image/q=auto,f=auto,metadata=none,width=300,height=200,fit=cover,gravity=0.8866x0.1874/https://prod.cdn-medias.jeuneafrique.com/medias/2024/09/20/sdja-migr-1-2.png",https://www.jeuneafrique.com/1611708/politique/guinee-vers-une-transition-a-duree-indeterminee/,Guinée,,jeuneafrique,fr,,
Société générale confie sa filiale guinéenne à AFG Holding,,,20 sept. 2024,"Le groupe bancaire de l’Ivoirien Bernard Koné Dossongui coiffe au poteau d’importants candidats à la reprise de SG Guinée, notamment Banque Atlantique et Bank of Kigali.",,"https://prod.cdn-medias.jeuneafrique.com/cdn-cgi/image/q=auto,f=auto,metadata=none,width=300,height=200,fit=cover,gravity=0.5000x0.5000/https://prod.cdn-medias.jeuneafrique.com/medias/2024/09/20/jad20240920-eco-guinee-sg-afg.jpg",https://www.jeuneafrique.com/1611469/economie-entreprises/societe-generale-confie-sa-filiale-guineenne-a-afg-holding/,Guinée,,jeuneafrique,fr,,
Guinée : les détails de la réincarcération de Claude Pivi,,,19 sept. 2024,"Arrêté à la frontière entre la Guinée et le Liberia le 17 septembre, après dix mois de cavale, Claude Pivi a été reconduit dès le lendemain en prison. Le garde des Sceaux a donné des précisions à Jeune Afrique.",,"https://prod.cdn-medias.jeuneafrique.com/cdn-cgi/image/q=auto,f=auto,metadata=none,width=300,height=200,fit=cover,gravity=0.5496x0.0370/https://prod.cdn-medias.jeuneafrique.com/medias/2024/09/20/jad20242009-ass-guinee-claude-pivi.jpg",https://www.jeuneafrique.com/1611332/politique/guinee-les-details-de-la-reincarceration-de-claude-pivi/,Guinée,,jeuneafrique,fr,,
"Fin de cavale pour Claude Pivi, le fugitif le plus recherché de Guinée",,,18 sept. 2024,"En fuite depuis novembre 2023, l’ennemi public numéro 1 de la junte dirigée à Conakry par Mamadi Doumbouya a été arrêté, mardi 17 septembre, au Liberia.",,"https://prod.cdn-medias.jeuneafrique.com/cdn-cgi/image/q=auto,f=auto,metadata=none,width=300,height=200,fit=cover,gravity=0.9110x0.2401/https://prod.cdn-medias.jeuneafrique.com/medias/2024/09/20/template-31.png",https://www.jeuneafrique.com/1610331/politique/fin-de-cavale-pour-claude-pivi-le-fugitif-le-plus-recherche-de-guinee/,Guinée,,jeuneafrique,fr,,
Guinée : des émissaires de Doumbouya fraichement reçus par les Forestiers,,,17 sept. 2024,"Des personnalités assurant avoir été envoyées par la présidence ont séjourné dans la très convoitée région de Guinée forestière, afin d’annoncer la candidature de Mamadi Doumbouya à la présidentielle. Non sans déclencher certaines hostilités.",,"https://prod.cdn-medias.jeuneafrique.com/cdn-cgi/image/q=auto,f=auto,metadata=none,width=300,height=200,fit=cover/https://prod.cdn-medias.jeuneafrique.com/medias/2024/09/17/jad20240916-ass-guinee-candidature-doumbouya.jpg",https://www.jeuneafrique.com/1609608/politique/presidentielle-en-guinee-des-emissaires-de-doumbouya-fraichement-recus-par-les-forestiers/,Guinée,,jeuneafrique,fr,,
"Cedeao, AES, France, Russie, Turquie… Qui sont les amis de Mamadi Doumbouya ?",,,17 sept. 2024,"En Guinée, les autorités ont su s’accommoder de partenaires diplomatiques et économiques aux intérêts divergents et sont parvenues, en dépit de certaines dérives, à faire figure de bon élève parmi les transitions ouest-africaines.",,"https://prod.cdn-medias.jeuneafrique.com/cdn-cgi/image/q=auto,f=auto,metadata=none,width=300,height=200,fit=cover/https://prod.cdn-medias.jeuneafrique.com/medias/2024/09/02/jad20240902-gfguinee-diplomatie.jpg",https://www.jeuneafrique.com/1602537/politique/cedeao-aes-france-russie-turquie-qui-sont-les-amis-de-mamadi-doumbouya/,Guinée,,jeuneafrique,fr,,
Guinée : où est donc passé Alpha Condé ?,,,13 sept. 2024,"L’ancien président, renversé par le général Mamadi Doumbouya le 5 septembre 2021, s’est adressé aux Guinéens « depuis l’Afrique », laissant entendre qu’il avait temporairement quitté Istanbul. Jeune Afrique l’a contacté.",,"https://prod.cdn-medias.jeuneafrique.com/cdn-cgi/image/q=auto,f=auto,metadata=none,width=300,height=200,fit=cover,gravity=0.5000x0.5000/https://prod.cdn-medias.jeuneafrique.com/medias/2024/09/13/jad20240913-ass-guinee-alpha-conde.jpg",https://www.jeuneafrique.com/1608747/politique/guinee-ou-est-donc-passe-alpha-conde/,Guinée,,jeuneafrique,fr,,
"Ismaël Diakité : « Avec la bauxite, la Guinée a une vraie carte à jouer sur le marché mondial des minerais critiques »",,,9 sept. 2024,"L’INTERVIEW ÉCO – Président de la Chambre des mines de Guinée depuis 2019 et haut représentant du consortium SMB-Winning, le premier producteur de bauxite du pays nous livre son analyse sur l’évolution et les perspectives du secteur minier dans le pays.",,"https://prod.cdn-medias.jeuneafrique.com/cdn-cgi/image/q=auto,f=auto,metadata=none,width=300,height=200,fit=cover/https://prod.cdn-medias.jeuneafrique.com/medias/2024/09/09/jad20240909-gfguinee-eco-itw-ismael-diakite.jpg",https://www.jeuneafrique.com/1602357/economie-entreprises/ismael-diakite-avec-la-bauxite-la-guinee-a-une-vraie-carte-a-jouer-sur-le-marche-mondial-des-minerais-critiques/,Guinée,,jeuneafrique,fr,,
"Anciens compagnons de route, jeunes loups, fidèles… Avec qui travaille Bah Oury, le Premier ministre guinéen ?",,,8 sept. 2024,"LA GARDE RAPPROCHÉE – Nommé par Mamadi Doumbouya le 27 février, l’ancien opposant doit composer avec une équipe qu’il n’a pas (totalement) choisie. Mais il s’est assuré d’avoir auprès de lui des hommes et des femmes de confiance.",,"https://prod.cdn-medias.jeuneafrique.com/cdn-cgi/image/q=auto,f=auto,metadata=none,width=300,height=200,fit=cover,gravity=0.5000x0.5000/https://prod.cdn-medias.jeuneafrique.com/medias/2024/08/30/gr34_bahoury.jpg",https://www.jeuneafrique.com/1603128/politique/anciens-compagnons-de-route-jeunes-loups-fideles-avec-qui-travaille-bah-oury-le-premier-ministre-guineen/,Guinée,,jeuneafrique,fr,,
Gilles Yabi : « La Cedeao demeure frileuse face aux dérives du pouvoir en Guinée »,,,7 sept. 2024,"L’ACTU VUE PAR – Trois ans après le coup d’État de Mamadi Doumbouya, l’analyste politique Gilles Yabi examine la trajectoire de la transition guinéenne dans le contexte sous-régional.",,"https://prod.cdn-medias.jeuneafrique.com/cdn-cgi/image/q=auto,f=auto,metadata=none,width=300,height=200,fit=cover,gravity=0.3027x0.3154/https://prod.cdn-medias.jeuneafrique.com/medias/2020/08/25/jad20200825-ass-tribune-gilles-yabi.jpg",https://www.jeuneafrique.com/1605307/politique/gilles-yabi-la-cedeao-est-frileuse-a-condamner-les-derives-du-pouvoir-en-guinee/,Guinée,,jeuneafrique,fr,,
Pétrole en Guinée : le plan de la Sonap pour éviter une nouvelle crise,,,6 sept. 2024,"Fragilisée par l’explosion de son principal dépôt pétrolier en décembre 2023 et par des connexions controversées avec un trader nigérian, la Société nationale des pétroles de Guinée relance ses chantiers prioritaires et sa stratégie, en amont comme en aval de la filière.",,"https://prod.cdn-medias.jeuneafrique.com/cdn-cgi/image/q=auto,f=auto,metadata=none,width=300,height=200,fit=cover/https://prod.cdn-medias.jeuneafrique.com/medias/2024/09/02/jad20240902-gfguinee-eco-sonap.jpg",https://www.jeuneafrique.com/1603365/economie-entreprises/petrole-en-guinee-le-plan-de-la-sonap-pour-eviter-une-nouvelle-crise/,Guinée,,jeuneafrique,fr,,
Simandou au cœur des discussions entre Doumbouya et Xi Jinping,,,5 sept. 2024,"À Pékin, en marge du Forum sur la coopération sino-africaine (Focac), le chef de la transition guinéenne s’est entretenu avec le président chinois et a affirmé vouloir faire de la Chine un partenaire économique privilégié, en particulier dans le domaine minier.",,"https://prod.cdn-medias.jeuneafrique.com/cdn-cgi/image/q=auto,f=auto,metadata=none,width=300,height=200,fit=cover,gravity=0.5000x0.5000/https://prod.cdn-medias.jeuneafrique.com/medias/2024/09/05/jad20240905-ass-guinee-focac-doumbouya-xi-jiping.jpg",https://www.jeuneafrique.com/1605753/politique/simandou-au-coeur-des-discussions-entre-doumbouya-et-xi-jinping/,Guinée,,jeuneafrique,fr,,
Guinée : Conakry à l’arrêt pour les trois ans de l’arrivée de Doumbouya au pouvoir,,,5 sept. 2024,Aucune activité officielle n’est prévue pour marquer les trois ans de l’accession des militaires à la tête du pays. Mais les mouvements de contestation pour dénoncer la répression envers les dissidents et demander un retour des civils au pouvoir se poursuivent.,,"https://prod.cdn-medias.jeuneafrique.com/cdn-cgi/image/q=auto,f=auto,metadata=none,width=300,height=200,fit=cover/https://prod.cdn-medias.jeuneafrique.com/medias/2024/09/05/jad20240905-ass-guinee-conakry-arret.jpg",https://www.jeuneafrique.com/1605943/politique/guinee-conakry-a-larret-pour-les-trois-ans-de-larrivee-de-doumbouya-au-pouvoir/,Guinée,,jeuneafrique,fr,,
"En Guinée, les autorités suspendent la « délivrance des agréments » aux ONG et associations",,,3 sept. 2024,Cette décision intervient alors que l’opposition appelle à manifester à l’approche du troisième anniversaire de l’arrivée des militaires au pouvoir à Conakry.,,"https://prod.cdn-medias.jeuneafrique.com/cdn-cgi/image/q=auto,f=auto,metadata=none,width=300,height=200,fit=cover/https://prod.cdn-medias.jeuneafrique.com/medias/2024/08/13/jad20240813-ass-guinee-constitutionsurmesure-mamadidoumbouya-photo2.jpg",https://www.jeuneafrique.com/1604505/politique/en-guinee-les-autorites-suspendent-la-delivrance-des-agrements-aux-ong-et-associations/,Guinée,,jeuneafrique,fr,,
