title,author_name,author_url,publication_date,description,category,image_url,url,country,content_preview,extractor,lang,content,source
Basket : grande première pour le Soudan du Sud aux Jeux olympiques de Paris,,,25 juil. 2024,"Indépendant depuis 2011, le Soudan du Sud verra sa sélection nationale de basket disputer pour la première le tournoi olympique masculin. Une participation qui confirme les progrès fulgurants des Bright Stars.",,"https://prod.cdn-medias.jeuneafrique.com/cdn-cgi/image/q=auto,f=auto,metadata=none,width=300,height=200,fit=cover,gravity=0.5000x0.5000/https://prod.cdn-medias.jeuneafrique.com/medias/2024/07/24/jad20240724-jo-basket-sudsoudan.jpg",https://www.jeuneafrique.com/1582588/societe/basket-grande-premiere-pour-le-soudan-du-sud-aux-jeux-olympiques-de-paris/,Tanzanie,,jeuneafrique,fr,,
Six journalistes incarcérés pour une vidéo embarrassante de Salva Kiir,,,9 janv. 2023,"Près d’un mois après la diffusion de cette vidéo sur les réseaux sociaux où elle a été largement partagée, six journalistes sud-soudanais ont été arrêtés.",,"https://prod.cdn-medias.jeuneafrique.com/cdn-cgi/image/q=auto,f=auto,metadata=none,width=300,height=200,fit=cover/https://prod.cdn-medias.jeuneafrique.com/medias/2023/01/09/savakiirgate_journalistes_1256.jpg",https://www.jeuneafrique.com/1407049/politique/six-journalistes-incarceres-pour-une-video-embarrassante-de-salva-kiir/,Tanzanie,,jeuneafrique,fr,,
Soudan du Sud : le plus jeune État du monde a dix ans,,,9 juil. 2021,"Il y a dix ans, le 54e pays d’Afrique voyait officiellement le jour. Mais cette première décennie a été à l’image des précédentes : tumultueuse.",,"https://prod.cdn-medias.jeuneafrique.com/cdn-cgi/image/q=auto,f=auto,metadata=none,width=300,height=200,fit=cover/https://prod.cdn-medias.jeuneafrique.com/medias/2021/06/09/jad20210609-ass-secretsdhistoire-soudandusud.jpg",https://www.jeuneafrique.com/1184535/politique/soudan-du-sud-le-plus-jeune-etat-du-monde-a-dix-ans/,Tanzanie,,jeuneafrique,fr,,
Soudan du Sud : le chef rebelle Riek Machar nommé vice-président,,,22 févr. 2020,Le chef rebelle sud-soudanais Riek Machar a été nommé officiellement premier vice-président vendredi soir. Il devrait prêter serment samedi.,,"https://prod.cdn-medias.jeuneafrique.com/cdn-cgi/image/q=auto,f=auto,metadata=none,width=300,height=200,fit=cover/https://prod.cdn-medias.jeuneafrique.com/medias/2020/02/22/sipa_ap22390724_000001.jpg",https://www.jeuneafrique.com/900399/politique/soudan-du-sud-le-chef-rebelle-riek-machar-nomme-vice-president/,Tanzanie,,jeuneafrique,fr,,
Soudan du Sud : Salva Kiir et Riek Machar prêts à former un gouvernement d’union nationale,,,21 févr. 2020,"Le président sud-soudanais Salva Kiir et le chef rebelle Riek Machar se sont entendus jeudi pour créer un gouvernement d’union nationale d’ici samedi, après six années de guerre civile.",,"https://prod.cdn-medias.jeuneafrique.com/cdn-cgi/image/q=auto,f=auto,metadata=none,width=300,height=200,fit=cover/https://prod.cdn-medias.jeuneafrique.com/medias/2020/02/21/a7fd2f8b3d6c7309527db0de88212d92b925a0b9.jpg",https://www.jeuneafrique.com/899504/politique/soudan-du-sud-salva-kiir-et-riek-machar-prets-a-former-un-gouvernement-dunion-nationale/,Tanzanie,,jeuneafrique,fr,,
Soudan du Sud : Riek Machar rejette la proposition de découpage administratif de Salva Kiir,,,16 févr. 2020,Les rebelles sud-soudanais ont rejeté dimanche la proposition du président Salva Kiir de revenir à un système fédéral de dix États qui avait suscité l’espoir d’ouvrir la voie à la formation d’un gouvernement d’union nationale.,,"https://prod.cdn-medias.jeuneafrique.com/cdn-cgi/image/q=auto,f=auto,metadata=none,width=300,height=200,fit=cover/https://prod.cdn-medias.jeuneafrique.com/medias/2015/08/21/kiir.jpg",https://www.jeuneafrique.com/897079/politique/soudan-du-sud-riek-machar-rejette-la-proposition-de-decoupage-administratif-de-salva-kiir/,Tanzanie,,jeuneafrique,fr,,
"Soudan du Sud : toujours pas de gouvernement d’union nationale, Washington rappelle son ambassadeur",,,26 nov. 2019,"Les États-Unis ont rappelé leur ambassadeur au Soudan du Sud pour « réexaminer » les relations avec ce pays, en guerre après l’échec à former un gouvernement d’union nationale dans les délais prévus, a annoncé lundi le département d’État américain.",,"https://prod.cdn-medias.jeuneafrique.com/cdn-cgi/image/q=auto,f=auto,metadata=none,width=300,height=200,fit=cover/https://prod.cdn-medias.jeuneafrique.com/medias/2018/07/08/soudannsud.png",https://www.jeuneafrique.com/861568/politique/soudan-du-sud-toujours-pas-de-gouvernement-dunion-nationale-washington-rappelle-son-ambassadeur/,Tanzanie,,jeuneafrique,fr,,
"Au Soudan du Sud, le conflit est nourri par une violente guerre du bétail",,,12 mai 2019,La militarisation du vol de bétail et l’armement des éleveurs par les principaux chefs politiques empêchent de transformer l’accord de paix en une réelle fin de la violence.,,"https://prod.cdn-medias.jeuneafrique.com/cdn-cgi/image/q=auto,f=auto,metadata=none,width=300,height=200,fit=cover/https://prod.cdn-medias.jeuneafrique.com/medias/2017/03/16/sipa_ap22021686_000017.jpg",https://www.jeuneafrique.com/773665/politique/au-soudan-du-sud-le-conflit-est-nourri-par-une-violente-guerre-du-betail/,Tanzanie,,jeuneafrique,fr,,
Soudan du Sud : Issayas Afeworki et Abiy Ahmed à Juba pour appuyer l’accord de paix,,,5 mars 2019,Le président érythréen Issayas Afeworki et le Premier ministre éthiopien Abiy Ahmed ont discuté lundi à Juba des moyens de renforcer le processus de paix au Soudan du Sud avec leur homologue Salva Kiir.,,"https://prod.cdn-medias.jeuneafrique.com/cdn-cgi/image/q=auto,f=auto,metadata=none,width=300,height=200,fit=cover/https://prod.cdn-medias.jeuneafrique.com/medias/2019/03/05/abiy-et-issayas.jpg",https://www.jeuneafrique.com/744804/politique/soudan-du-sud-issayas-afeworki-et-abiy-ahmed-a-juba-pour-appuyer-laccord-de-paix/,Tanzanie,,jeuneafrique,fr,,
Viols au Soudan du Sud : l’ONU accuse de nouveau l’armée,,,20 févr. 2019,"Des soldats du Soudan du Sud portent probablement une part de responsabilité dans les viols et agressions sexuelles de plus de 150 femmes et jeunes filles, survenus en décembre près de Bentiu, a révélé un rapport de l’ONU. Depuis le début de la guerre civile, le viol est devenu une arme de guerre systématique.",,"https://prod.cdn-medias.jeuneafrique.com/cdn-cgi/image/q=auto,f=auto,metadata=none,width=300,height=200,fit=cover/https://prod.cdn-medias.jeuneafrique.com/medias/2016/11/18/sipa_ap21951341_000002.jpg",https://www.jeuneafrique.com/737896/politique/viols-au-soudan-du-sud-lonu-accuse-de-nouveau-larmee/,Tanzanie,,jeuneafrique,fr,,
États-Unis : Trump change de cap en Afrique pour contrer les « pratiques prédatrices » de la Russie et de la Chine,,,13 déc. 2018,"Guerre d’influence avec Moscou et Pékin, coupe des ressources budgétaires pour la diplomatie… Dans une déclaration devant la Heritage Foundation, un think thank conservateur, le conseiller pour la sécurité nationale de Donald Trump a dévoilé la nouvelle stratégie américaine en Afrique.",,"https://prod.cdn-medias.jeuneafrique.com/cdn-cgi/image/q=auto,f=auto,metadata=none,width=300,height=200,fit=cover/https://prod.cdn-medias.jeuneafrique.com/medias/2018/03/27/sipa_ap22020332_000001-e1544726822598.jpg",https://www.jeuneafrique.com/685721/politique/etats-unis-trump-change-de-cap-en-afrique-pour-contrer-les-pratiques-predatrices-de-la-russie-et-de-la-chine/,Tanzanie,,jeuneafrique,fr,,
"Malgré les sanctions, les armes ont continué à affluer au Soudan du Sud, selon une ONG",,,30 nov. 2018,"Même s’il est soumis à des embargos sur les armes, le Soudan du Sud, en guerre civile depuis décembre 2013, a continué à recevoir de l’armement, qui a transité le plus souvent par des pays voisins, selon un rapport de l’ONG britannique Conflict Armament Research publié jeudi 29 novembre.",,"https://prod.cdn-medias.jeuneafrique.com/cdn-cgi/image/q=auto,f=auto,metadata=none,width=300,height=200,fit=cover/https://prod.cdn-medias.jeuneafrique.com/medias/2018/11/30/soudan-du-sud-e1560357938329.jpg",https://www.jeuneafrique.com/674018/politique/malgre-les-sanctions-les-armes-ont-continue-a-affluer-au-soudan-du-sud-selon-une-ong/,Tanzanie,,jeuneafrique,fr,,
Soudan du Sud : Riek Machar à Juba pour la première fois depuis deux ans,,,31 oct. 2018,"Le chef rebelle Riek Machar est arrivé mercredi 31 octobre à Juba, après plus de deux ans d’absence, pour participer à une cérémonie célébrant la signature d’un nouvel accord de paix au Soudan du Sud.",,"https://prod.cdn-medias.jeuneafrique.com/cdn-cgi/image/q=auto,f=auto,metadata=none,width=300,height=200,fit=cover/https://prod.cdn-medias.jeuneafrique.com/medias/2018/10/31/sipa_ap22265231_000001.jpg",https://www.jeuneafrique.com/656094/politique/soudan-du-sud-riek-machar-a-juba-pour-la-premiere-fois-depuis-deux-ans/,Tanzanie,,jeuneafrique,fr,,
Soudan du Sud : le nouvel accord de paix accueilli avec prudence,,,13 sept. 2018,"Le nouvel accord de paix signé mercredi 12 septembre par le président Salva Kiir et le chef rebelle Riek Machar est accueilli avec un mélange de prudence et de scepticisme, aussi bien dans le pays qu’au sein de la communauté internationale.",,"https://prod.cdn-medias.jeuneafrique.com/cdn-cgi/image/q=auto,f=auto,metadata=none,width=300,height=200,fit=cover/https://prod.cdn-medias.jeuneafrique.com/medias/2018/08/06/kiir-machar.jpg",https://www.jeuneafrique.com/629224/politique/soudan-du-sud-le-nouvel-accord-de-paix-accueilli-avec-prudence/,Tanzanie,,jeuneafrique,fr,,
Crash d’un avion au Soudan du Sud : 19 morts,,,9 sept. 2018,"Dix-neuf personnes ont été tuées dimanche quand un petit avion de ligne s’est abîmé dans un lac du centre du Soudan du Sud, a annoncé à l’AFP un responsable régional.",,"https://prod.cdn-medias.jeuneafrique.com/cdn-cgi/image/q=auto,f=auto,metadata=none,width=300,height=200,fit=cover/https://prod.cdn-medias.jeuneafrique.com/medias/2018/09/09/800px-the_yirol_road_just_outside_yirol_town_south_sudan-e1536508922419.jpg",https://www.jeuneafrique.com/627017/societe/crash-dun-avion-au-soudan-du-sud-19-morts/,Tanzanie,,jeuneafrique,fr,,
Soudan du Sud : l’accord de paix doit être signé le 12 septembre,,,8 sept. 2018,"Le président sud-soudanais Salva Kiir et son opposant le chef rebelle Riek Machar signeront officiellement l’accord de paix lors d’un sommet en Ethiopie le 12 septembre, a affirmé samedi le médiateur soudanais.",,"https://prod.cdn-medias.jeuneafrique.com/cdn-cgi/image/q=auto,f=auto,metadata=none,width=300,height=200,fit=cover/https://prod.cdn-medias.jeuneafrique.com/medias/2018/09/08/sipa_ap22223356_000001-e1536420590920.jpg",https://www.jeuneafrique.com/626689/politique/soudan-du-sud-laccord-de-paix-doit-etre-signe-le-12-septembre/,Tanzanie,,jeuneafrique,fr,,
Soudan du Sud : Salva Kiir amnistie Riek Machar et d’autres rebelles,,,9 août 2018,"Quelques jours après la signature d’un accord sur le partage du pouvoir, le président sud-soudanais Salva Kiir a publié un décret par lequel il amnistie des rebelles, dont l’ex-vice président Riek Machar, a rapporté jeudi la radio d’État.",,"https://prod.cdn-medias.jeuneafrique.com/cdn-cgi/image/q=auto,f=auto,metadata=none,width=300,height=200,fit=cover/https://prod.cdn-medias.jeuneafrique.com/medias/2018/08/06/kiir-machar.jpg",https://www.jeuneafrique.com/613375/politique/soudan-du-sud-salva-kiir-amnistie-riek-machar-et-dautres-rebelles/,Tanzanie,,jeuneafrique,fr,,
Soudan du Sud : Salva Kiir et Riek Machar signent un accord sur le partage du pouvoir,,,6 août 2018,"Le gouvernement de Juba et les rebelles du Soudan du Sud ont signé dimanche à Khartoum un accord final sur le partage du pouvoir, le président Salva Kiir appelant à l’unité dans un pays ravagé par une guerre civile meurtrière.",,"https://prod.cdn-medias.jeuneafrique.com/cdn-cgi/image/q=auto,f=auto,metadata=none,width=300,height=200,fit=cover/https://prod.cdn-medias.jeuneafrique.com/medias/2018/08/06/kiir-machar.jpg",https://www.jeuneafrique.com/611463/politique/soudan-du-sud-salva-kiir-et-riek-machar-signent-un-accord-sur-le-partage-du-pouvoir/,Tanzanie,,jeuneafrique,fr,,
Soudan du Sud : un accord « préliminaire » sur le partage du pouvoir,,,25 juil. 2018,Rebelles et officiels ont signé mercredi à Khartoum un accord « préliminaire » sur le partage du pouvoir qui pourrait permettre le retour du dirigeant rebelle Riek Machar au poste de premier vice-président.,,"https://prod.cdn-medias.jeuneafrique.com/cdn-cgi/image/q=auto,f=auto,metadata=none,width=300,height=200,fit=cover/https://prod.cdn-medias.jeuneafrique.com/medias/2018/07/08/soudannsud.png",https://www.jeuneafrique.com/606017/politique/soudan-du-sud-un-accord-preliminaire-sur-le-partage-du-pouvoir/,Tanzanie,,jeuneafrique,fr,,
Soudan du Sud : l’ONU impose un embargo sur les armes ,,,13 juil. 2018,"Le Conseil de sécurité de l’ONU a imposé vendredi un embargo sur les armes au Soudan du Sud et des sanctions contre deux responsables militaires, alors que les tractations diplomatiques n’ont pas, en près de cinq ans de conflit, réussi à mettre un terme à la guerre civile.",,"https://prod.cdn-medias.jeuneafrique.com/cdn-cgi/image/q=auto,f=auto,metadata=none,width=300,height=200,fit=cover/https://prod.cdn-medias.jeuneafrique.com/medias/2018/07/14/onu.png",https://www.jeuneafrique.com/594080/politique/soudan-du-sud-lonu-impose-un-embargo-sur-les-armes/,Tanzanie,,jeuneafrique,fr,,
Soudan du Sud : accord pour que Riek Machar redevienne vice-président de Salva Kiir,,,8 juil. 2018,"Le gouvernement et les rebelles du Soudan du Sud, jeune pays enfoncé dans une guerre civile depuis 2013, ont accepté samedi en Ouganda un accord de partage du pouvoir qui doit voir le chef rebelle Riek Machar retrouver son poste de vice-président.",,"https://prod.cdn-medias.jeuneafrique.com/cdn-cgi/image/q=auto,f=auto,metadata=none,width=300,height=200,fit=cover/https://prod.cdn-medias.jeuneafrique.com/medias/2018/07/08/soudannsud.png",https://www.jeuneafrique.com/589920/politique/soudan-du-sud-accord-pour-que-riek-machar-redevienne-vice-president-de-salva-kiir/,Tanzanie,,jeuneafrique,fr,,
Soudan du Sud : accord entre les belligérants pour retirer leurs forces des « zones urbaines »,,,6 juil. 2018,"Le gouvernement et les rebelles du Soudan du Sud, jeune pays enfoncé dans une guerre civile depuis 2013, ont convenu de retirer leurs forces des « zones urbaines », dans le cadre d’un accord portant sur la sécurité signé à Khartoum vendredi par les deux parties.",,"https://prod.cdn-medias.jeuneafrique.com/cdn-cgi/image/q=auto,f=auto,metadata=none,width=300,height=200,fit=cover/https://prod.cdn-medias.jeuneafrique.com/medias/2018/07/07/khartoum.png",https://www.jeuneafrique.com/589639/politique/soudan-du-sud-les-belligerants-daccord-pour-retirer-leurs-forces-des-zones-urbaines/,Tanzanie,,jeuneafrique,fr,,
"Soudan du Sud : Riek Machar face à Salva Kiir, un duel interminable",,,6 juil. 2018,"Le président d’un côté, Salva Kiir, le rebelle de l’autre, Riek Machar, son ancien vice-président : chacun est convaincu que le temps joue en sa faveur. Et ne veut rien lâcher.",,"https://prod.cdn-medias.jeuneafrique.com/cdn-cgi/image/q=auto,f=auto,metadata=none,width=300,height=200,fit=cover/https://prod.cdn-medias.jeuneafrique.com/medias/2018/07/04/ja2999_match.jpg",https://www.jeuneafrique.com/mag/586423/politique/soudan-du-sud-riek-machar-face-a-salva-kiir-un-duel-interminable/,Tanzanie,,jeuneafrique,fr,,
"Haïti, Tchad, Soudan du Sud… L’ONG Oxfam au coeur de plusieurs scandales sexuels",,,13 févr. 2018,"Après Haïti et le Tchad, la litanie des révélations autour d’Oxfam se poursuit avec des accusations de viols visant certains employés au Soudan du Sud. Le gouvernement britannique menace désormais d’interrompre sa contribution financière à l’ONG.",,"https://prod.cdn-medias.jeuneafrique.com/cdn-cgi/image/q=auto,f=auto,metadata=none,width=300,height=200,fit=cover/https://prod.cdn-medias.jeuneafrique.com/medias/2018/02/13/oxfam.jpg",https://www.jeuneafrique.com/530351/politique/haiti-tchad-soudan-du-sud-long-oxfam-au-coeur-de-plusieurs-scandales-sexuels/,Tanzanie,,jeuneafrique,fr,,
Yahya Jammeh et Dan Gertler visés par des sanctions du Trésor américain,,,21 déc. 2017,"Le département du Trésor américain a décidé d’imposer une série de sanctions à 15 personnalités, en raison d’atteintes répétées aux droits de l’homme. L’ancien président gambien et l’homme d’affaires israélien proche de Joseph Kabila sont visés.",,"https://prod.cdn-medias.jeuneafrique.com/cdn-cgi/image/q=auto,f=auto,metadata=none,width=300,height=200,fit=cover/https://prod.cdn-medias.jeuneafrique.com/medias/2016/04/20/sipa_ap21672052_000002.jpg",https://www.jeuneafrique.com/504597/politique/yahya-jammeh-et-dan-gertler-vises-par-des-sanctions-du-tresor-americain/,Tanzanie,,jeuneafrique,fr,,
5 Questions à Sonja Wanda : ancien top model et nouvelle actrice prometteuse,,,28 nov. 2017,Son nom ne vous est sans doute pas familier. Pourtant Sonja Wanda a défilé pour les plus grands ! Aujourd’hui la Sud-Soudanaise ajoute une nouvelle corde à son arc grâce à son rôle dans le film « Par Instinct ». Entretien.,,"https://prod.cdn-medias.jeuneafrique.com/cdn-cgi/image/q=auto,f=auto,metadata=none,width=300,height=200,fit=cover/https://prod.cdn-medias.jeuneafrique.com/medias/2018/11/14/img_44-320x320.jpg",https://www.jeuneafrique.com/664158/culture/5-questions-a-sonja-wanda-ancien-top-model-et-nouvelle-actrice-prometteuse/,Tanzanie,,jeuneafrique,fr,,
Salva Kiir : « Le Soudan est la source d’armes qui vont au Soudan du Sud »,,,2 nov. 2017,"Le président sud-soudanais Salva Kiir, en visite à Khartoum, a accusé jeudi le Soudan d’être une « source d’armes » utilisées dans la guerre civile qui déchire son pays depuis quatre ans et fait des dizaines de milliers de morts.",,"https://prod.cdn-medias.jeuneafrique.com/cdn-cgi/image/q=auto,f=auto,metadata=none,width=300,height=200,fit=cover/https://prod.cdn-medias.jeuneafrique.com/medias/2017/11/02/salva-kiir.jpg",https://www.jeuneafrique.com/489046/politique/salva-kiir-le-soudan-est-la-source-darmes-qui-vont-au-soudan-du-sud/,Tanzanie,,jeuneafrique,fr,,
"Accès des filles à l’éducation : sur les dix pays les moins bien notés dans le monde, neuf sont africains",,,11 oct. 2017,"À l’occasion de la journée internationale de la fille, célébrée ce 11 octobre, l’ONG ONE a publié un rapport interpellant la communauté internationale sur les difficultés que rencontrent les filles pour aller à l’école.",,"https://prod.cdn-medias.jeuneafrique.com/cdn-cgi/image/q=auto,f=auto,metadata=none,width=300,height=200,fit=cover/https://prod.cdn-medias.jeuneafrique.com/medias/2017/10/11/filles-togo.jpg",https://www.jeuneafrique.com/482447/societe/journee-de-la-fille-9-des-10-pays-ou-les-filles-sont-le-moins-eduquees-sont-africains/,Tanzanie,,jeuneafrique,fr,,
"De Khartoum à Tarnac, des hommes et des révoltes",,,9 oct. 2017,"Un petit village français de Corrèze, dans le centre du pays, a accueilli une rencontre sur les mouvements d’opposition soudanais. Reportage au cœur de cette surprenante rencontre entre jeunes activistes français et soudanais.",,"https://prod.cdn-medias.jeuneafrique.com/cdn-cgi/image/q=auto,f=auto,metadata=none,width=300,height=200,fit=cover/https://prod.cdn-medias.jeuneafrique.com/medias/2017/10/09/img_2127-min.jpg",https://www.jeuneafrique.com/481680/societe/de-khartoum-a-tarnac-des-hommes-et-des-revoltes/,Tanzanie,,jeuneafrique,fr,,
Soudan du Sud : Riek Machar mobilise,,,5 sept. 2017,"Alors que Riek Machar, le principal opposant au président Salva Kiir dans le conflit sud-soudanais, se trouve toujours en résidence surveillée en Afrique du Sud, de nombreuses personnes s’activent pour obtenir sa remise en liberté.",,"https://prod.cdn-medias.jeuneafrique.com/cdn-cgi/image/q=auto,f=auto,metadata=none,width=300,height=200,fit=cover/https://prod.cdn-medias.jeuneafrique.com/medias/2016/03/21/sipa_ap21681971_000001.jpg",https://www.jeuneafrique.com/mag/471158/politique/soudan-du-sud-riek-machar-mobilise/,Tanzanie,,jeuneafrique,fr,,
"10 choses à savoir sur John Steenhuisen, pilier de la coalition gouvernementale en Afrique du Sud",,,3 oct. 2024,"Désormais membre du gouvernement, le leader de l’Alliance démocratique essaie d’exister face à Cyril Ramaphosa et à l’ANC. Et jamais son parti n’a été aussi proche du pouvoir.",,"https://prod.cdn-medias.jeuneafrique.com/cdn-cgi/image/q=auto,f=auto,metadata=none,width=300,height=200,fit=cover,gravity=0.5000x0.5000/https://prod.cdn-medias.jeuneafrique.com/medias/2024/09/27/jad-20240927-ass-afrique-sud-politique-10-choses-john-steenhuisen.jpg",https://www.jeuneafrique.com/1609707/politique/10-choses-a-savoir-sur-john-steenhuisen-pilier-de-la-coalition-gouvernementale-en-afrique-du-sud/,Afrique du Sud,,jeuneafrique,fr,,
« L’Afrique doit jouir d’une voix plus forte au Conseil de sécurité de l’ONU »,,,28 sept. 2024,"Le ministre sud-africain des Affaires étrangères, Ronald Lamola, s’est fait connaître en portant devant la justice internationale les accusations de « génocide » contre Israël. Il plaide aujourd’hui pour une réforme courageuse des Nations unies.",,"https://prod.cdn-medias.jeuneafrique.com/cdn-cgi/image/q=auto,f=auto,metadata=none,width=300,height=200,fit=cover,gravity=0.5874x0.4262/https://prod.cdn-medias.jeuneafrique.com/medias/2024/09/28/ronald-scaled.jpg",https://www.jeuneafrique.com/1614821/politique/lafrique-doit-jouir-dune-voix-plus-forte-au-conseil-de-securite-de-lonu/,Afrique du Sud,,jeuneafrique,fr,,
"Discovery, nouveau roi des assureurs africains",,,24 sept. 2024,"300 CHAMPIONS DE LA FINANCE – Pour la première fois numéro un de notre classement des assureurs, le sud-africain Discovery Health, initiateur d’une nouvelle façon de penser l’assurance, voit sa recherche continue de l’innovation récompensée.",,"https://prod.cdn-medias.jeuneafrique.com/cdn-cgi/image/q=auto,f=auto,metadata=none,width=300,height=200,fit=cover/https://prod.cdn-medias.jeuneafrique.com/medias/2024/09/24/jad20240924-300-champions-assurances-discovery.jpg",https://www.jeuneafrique.com/1612082/economie-entreprises/discovery-nouveau-roi-des-assureurs-africains/,Afrique du Sud,,jeuneafrique,fr,,
La Banque centrale d’Afrique du Sud abaisse son taux directeur,,,20 sept. 2024,"De nombreux pays commencent à réduire leurs taux d’intérêt, augmentés dans un contexte d’accélération de l’inflation après la pandémie de Covid-19 et l’invasion russe en Ukraine.",,"https://prod.cdn-medias.jeuneafrique.com/cdn-cgi/image/q=auto,f=auto,metadata=none,width=300,height=200,fit=cover/https://prod.cdn-medias.jeuneafrique.com/medias/2017/02/18/lesetja-kganyago-gcis.jpg",https://www.jeuneafrique.com/1611484/economie-entreprises/la-banque-centrale-dafrique-du-sud-abaisse-son-taux-directeur/,Afrique du Sud,,jeuneafrique,fr,,
"Pour Cyril Ramaphosa, deux sièges à l’ONU pour l’Afrique, oui, mais avec droit de veto",,,14 sept. 2024,"Le président sud-africain a salué vendredi 13 septembre le soutien des États-Unis à la création de deux sièges permanents au Conseil de sécurité de l’ONU pour des pays africains, mais il a estimé que leur refuser un droit de veto en feraient des « citoyens de seconde zone ».",,"https://prod.cdn-medias.jeuneafrique.com/cdn-cgi/image/q=auto,f=auto,metadata=none,width=300,height=200,fit=cover,gravity=0.5167x0.2710/https://prod.cdn-medias.jeuneafrique.com/medias/2024/09/14/ramaphosa.jpg",https://www.jeuneafrique.com/1609184/politique/pour-cyril-ramaphosa-deux-sieges-a-lonu-pour-lafrique-oui-mais-avec-droit-de-veto/,Afrique du Sud,,jeuneafrique,fr,,
"En Afrique du Sud, le chef de l’opposition menace de quitter le gouvernement",,,13 sept. 2024,"Le différend entre l’ANC et l’Alliance démocratique porte sur un projet de loi sur l’éducation qui menacerait, selon John Steenhuisen, la minorité afrikaner et sa langue, l’afrikaans.",,"https://prod.cdn-medias.jeuneafrique.com/cdn-cgi/image/q=auto,f=auto,metadata=none,width=300,height=200,fit=cover/https://prod.cdn-medias.jeuneafrique.com/medias/2023/04/03/jad20230403-ass-afdus-steenhuisen-01.jpg",https://www.jeuneafrique.com/1608634/politique/en-afrique-du-sud-le-chef-de-lopposition-menace-de-quitter-le-gouvernement/,Afrique du Sud,,jeuneafrique,fr,,
Un régulateur sud-africain épingle TotalEnergies pour « greenwashing »,,,22 août 2024,"Baptisée #FuelYourExperience, la campagne visée a été réalisée en collaboration avec l’autorité sud-africaine de protection de la nature, Sanparks, pour encourager les gens à visiter les parcs nationaux du pays. Le groupe français y affirme être « engagé en faveur du développement durable et de la protection de l’environnement ».",,"https://prod.cdn-medias.jeuneafrique.com/cdn-cgi/image/q=auto,f=auto,metadata=none,width=300,height=200,fit=cover/https://prod.cdn-medias.jeuneafrique.com/medias/2023/09/14/jad20230914-eco-aerien-prix-carburant.jpg",https://www.jeuneafrique.com/1601309/economie-entreprises/un-regulateur-sud-africain-epingle-totalenergies-pour-greenwashing/,Afrique du Sud,,jeuneafrique,fr,,
